"73",7.2,"3/11/2016",3.59,90,140,"Monk Hammer","7.2% India Pale Ale ","monkhammer",218,"Monk Hammer","Our Ruthless IPA With A Belgian Twist.","03/2016","Jack Hammer has been single handedly ripping it up for quite some time. Now, the definitive bitter and twisted IPA, has spawned four Hammer Head off-springs. Monk Hammer is the first of our super-charge hyped up hybrids. A dark cloaked holy man packing an unholy punch. Belgian yeast and American hops untie on a cardinal scale. Steel yourself for biblical volumes of grapefruit, bow your head for a wave of spicy, fruity yeast character, then cross yourself for the bitterest of bitter finishes. Let your senses succumb to this 21st century incarnation. Monk Hammer – worship daily.","https://images.punkapi.com/v2/218.png",7.2,250,1010,1065,15,7.5,4.4,84.6,20,"liters",25,"liters","Pesto chicken pizza","Beer braised Brussels sprouts","Cre`me bru^le´e","Oxygen is critical for this strain of yeast so make sure you aerate your wort properly.","Sam Mason <samjbmason>",NA,NA,0,0,0,0,100,0,0,0,0,0,0,0,0,0,0,0,0,0,0,0,0,0,0,0,0,0,0,0,0,0,0,0,0,0,0,25,50,18.75,0,0,0,0,0,0,0,0,0,0,0,100,0,0,0,0,0,0,0,0,0,0,0,0,0,0,0,0,30,0,0,0,25,18.75,0,0,0,0,0,0,0,0,0,0,0,0,0,0,0,0,0,0,0,0,0,0,0,0,0,0,0,0,0,0,0,0,0,0,0,0,0,0,0,0,0,0,0,0,0,0,0,0,0,0,0,0,0,0,0,0,0,0,0,0,0,0,0,0,0,0,0,0,0,0,0,0,0,0,0,0,0,0,0,0,0,0,0,0,0,0,0,0,0,0,0,0,0,0,0,0,0,0,0,0,0,0,0,0,0,0,0,0,0,0,0,0,0,0,0,0,0,0,0,0,0,0,0,0,0,0,0,0,0,0,0,100,0,0,0,0,0,0,0,0,0,0,0,0,0,0,0,0,0,0,0,0,0,0,0,0,0,0,0,0,0,0,0,0,"kilograms",0,0,0,0,0,0,0,0,0,0,0,0,0,0,0,0,0,0,0,0,0,0,0,0,0,0,0,0,0,0,0,0,0,0,0,5.8,0,0,0,0,0,0,0,0,0,0,0,0,0,0,0,0,0,0,0,0,0,0,0,0,0,0,0,0,0,0,0,0,0,0,0,0,0,0,0,0,0,0,0,0,0,0,0,0,0,0,0,0,0,0,0,65,"celsius",75,21,"celsius",NA,NA,NA,NA,NA,NA,NA,NA,NA,NA,NA,NA,NA
"74",5.2,"12/20/2013",3.48,91,118,"Moshi Moshi 15","5.2% American Pale Ale","moshimoshi15",197,"Moshi Moshi 15","American Pale Ale Birthday Beer.","11/2013","A riot of C-hops, with layers of grapefruit, lime zest, pine needles, freshly cut grass, pungent resin, layered up on toasty malt with a touch of caramel sweetness.","https://images.punkapi.com/v2/197.png",5.2,45,1011,1048,35,17.5,4.4,77.1,20,"liters",25,"liters","Spicy Vietnamese vermicelli salad","Spicy fish tacos with mango chilli","Banana bread","Some Munich malt in this beer will lift the biscuity backbone, and provide much needed balance to the heavy hitting US hops.","Ali Skinner <AliSkinner>",NA,NA,0,0,0,0,0,0,0,0,0,0,0,0,0,0,0,0,0,0,0,0,0,0,0,0,0,0,0,0,100,0,0,0,0,100,0,0,18.5,6,0,0,0,0,0,0,0,0,0,0,0,0,0,0,0,0,0,0,0,0,0,0,0,0,0,0,0,0,0,100,0,2.5,18.5,3.5,0,0,0,0,0,0,0,0,0,0,0,0,0,0,0,0,0,0,0,0,0,0,0,0,0,0,0,0,0,0,0,0,0,0,0,0,0,0,0,0,0,0,0,0,0,0,0,0,0,0,0,0,0,0,0,0,0,0,0,0,0,0,0,0,0,0,0,0,0,0,0,0,0,0,0,0,0,0,0,0,0,0,0,0,0,0,0,0,0,0,0,0,0,0,0,0,0,0,0,0,0,0,0,0,0,0,0,0,0,0,0,0,0,0,0,0,0,0,0,0,0,0,0,0,0,0,0,0,0,0,0,0,0,0,0,0,0,0,0,0,0,0,0,0,0,0,0,0,0,0,0,0,0,0,0,0,0,0,0,0,0,0,0,0,"kilograms",0,0,0,0,0,0,0,0,0,0,0,0,0,0,0,0,0,0.88,0,0,0,0,0,0,0,0.19,0,0,0,0,0,0,0,0,0,3,0,0,0,0,0,0,0,0,0,0,0,0,0,0,0,0,0.13,0,0,0,0,0,0,0,0,0,0,0,0,0,0,0,0,0,0,0,0,0,0,0,0,0,0,0,0,0,0,0,0,0,0,0,0,0,0,65,"celsius",75,19,"celsius",NA,NA,NA,NA,NA,NA,NA,NA,NA,NA,NA,NA,NA
"75",4.7,"11/24/2012",3.34,41,14,"Movember","4.7% Black IPA","movember",13,"Movember","Moustache-Worthy Beer.","11/2009","A deliciously robust, black malted beer with a decadent dark, dry cocoa flavour that provides an enticing backdrop to the Cascade hops.","https://images.punkapi.com/v2/13.png",4.5,50,1012,1047,140,70,5.2,74.5,20,"liters",25,"liters","Vegetable egg scramble","Margherita pizza","Fresh berry crisp tart","If you can’t find really fresh cascade, substitute it for Amarillo or Ahtanum.","Sam Mason <samjbmason>",NA,NA,0,0,0,0,0,0,0,0,0,0,0,0,0,0,0,0,0,0,0,0,0,0,0,0,0,0,0,0,250,43.8,81.3,0,0,0,0,0,0,0,0,0,0,0,0,0,0,0,0,0,0,0,0,0,0,0,0,0,0,0,0,0,0,0,0,0,0,0,0,0,0,0,0,0,0,0,0,0,0,0,0,0,0,0,0,0,0,0,0,0,0,0,0,0,0,0,0,0,0,0,0,0,0,0,0,0,0,0,0,0,0,0,0,0,0,0,0,0,0,0,0,0,0,0,0,0,0,0,0,0,0,0,0,0,0,0,0,0,0,0,0,0,0,0,0,0,0,0,0,0,0,0,0,0,0,0,0,0,0,0,0,0,0,0,0,0,0,0,0,0,0,0,0,0,0,0,0,0,0,0,0,0,0,0,0,0,0,0,0,0,0,0,0,0,0,0,0,0,0,0,0,0,0,0,0,0,0,0,0,0,0,0,0,0,0,0,0,0,0,0,0,0,0,0,0,0,0,0,0,0,0,0,0,0,0,0,0,0,"kilograms",0,0,0,0,0,0,0,0,0,0,0,0,0,0.31,0,0.31,0,0.63,0,0,0,0,0,0,0,0.31,0,0,0,0,0,0,0,0,0,0,3.44,0,0,0,0,0,0,0,0,0,0,0,0,0,0,0,0,0,0,0,0,0,0,0,0,0,0,0,0,0,0,0,0,0,0,0,0,0,0,0,0,0,0,0,0,0,0,0,0,0,0,0,0,0,0,68,"celsius",50,19,"celsius",NA,NA,NA,NA,NA,NA,NA,NA,NA,NA,NA,NA,NA
"76",0.5,"2/6/2010",2.87,96,613,"Nanny State","0.5% Low Alcohol","nannystate",31,"Nanny State","Alcohol Free Hoppy Ale.","08/2009","Brewing a full flavoured craft beer at 0.5% is no easy task. Packed with loads of Centennial, Amarillo, Columbus, Cascade and Simcoe hops, dry hopped to the brink and back and sitting at 55 IBUs, Nanny State is a force to be reckoned with. With a backbone of 8 different specialty malts, Nanny State will tantalise your taste buds and leave you yearning for more.","https://images.punkapi.com/v2/31.png",0.5,55,1005,1007,30,15,4.4,28.6,20,"liters",25,"liters",NA,NA,NA,"Get hops in every stage of the brewing process - mash, run off boil and flame off. There's not too much malt body, so the more hops the better.","Sam Mason <samjbmason>",NA,"Earthy mushroom pasta",25,0,12.5,0,0,0,6.3,0,5,6.3,0,0,0,0,0,0,0,0,0,0,0,0,0,0,0,0,0,0,50,0,12.5,0,0,50,0,6.3,0,6.3,0,0,0,0,0,0,0,0,0,0,0,0,0,0,0,0,0,0,0,0,0,0,0,0,0,0,0,0,0,37.5,0,0,0,0,0,0,0,0,0,0,0,0,0,0,0,0,0,0,0,0,0,0,0,0,0,0,0,0,0,0,0,0,0,0,0,0,0,0,0,0,0,0,0,0,0,0,0,0,0,0,0,0,0,0,0,0,0,0,0,0,0,0,0,0,0,0,0,0,0,0,0,0,0,0,0,0,0,0,0,0,0,0,0,0,0,0,0,0,0,0,0,0,0,0,0,0,0,0,0,0,0,0,0,0,0,0,0,0,0,0,0,0,0,0,0,0,0,0,0,0,0,0,0,0,0,0,0,0,0,0,0,0,0,0,0,25,0,0,5,0,5,2.5,0,0,0,0,0,0,0,0,0,0,0,0,0,0,0,0,0,0,0,0,0,0,0,0,0,0,"kilograms",0,0,0.03,0,0,0,0,0,0,0,0,0,0,0,0,0,0,0.19,0,0,0,0.06,0,0,0,0.06,0,0,0.13,0,0,0,0,0,0,0,0,0,0,0,0,0,0,0,0,0,0,0,0,0,0,0,0.13,0,0,0,0,0,0,0,0,0,0,0,0,0,0,0,0,0,0,0,0,0,0,0,0.13,0,0,0,0,0,0,0,0,0,0,0.06,0,0,0,65,"celsius",30,19,"celsius",NA,NA,NA,NA,NA,NA,NA,NA,NA,NA,NA,NA,NA
"77",6.5,"7/25/2012",3.25,40,129,"Never Mind The Anabolics","6.5% India Pale Ale ","nevermindtheanabolics",75,"Never Mind The Anabolics","Performance-Enhancing India Pale Ale.","06/2012","Never Mind the Anabolics, a 6.5% India Pale Ale brewed with copious amounts of performance-enhancing natural ingredients. Brewed to commemorate the 2012 Olympics and its merry marketing bandwagon.","https://images.punkapi.com/v2/75.png",6.5,35,1012,1050,23,11.5,4.4,76,20,"liters",25,"liters","Grilled chicken salad with bacon and avocado","Red pepper houmous and flat bread","Matcha green tea cake","Mix the powders into a paste before adding to the wort kettle. This will prevent the powders from balling up and not bringing the full flavour effect.","Sam Mason <samjbmason>",NA,NA,0,0,0,0,0,0,0,0,0,0,0,0,0,0,0,0,0,0,0,0,0,0,0,0,0,0,0,0,0,0,0,0,0,0,0,0,0,0,0,0,0,0,0,0,0,0,0,0,0,0,0,0,0,0,0,0,0,0,0,0,0,0,0,0,0,0,0,0,0,0,0,0,0,0,0,0,0,0,0,0,0,0,0,0,0,0,0,0,0,0,0,0,0,0,0,0,0,0,0,0,0,0,0,0,0,0,0,0,0,0,0,0,0,0,0,0,0,0,0,0,0,0,0,0,0,0,0,0,0,0,0,0,0,0,0,0,0,0,0,0,0,0,0,0,0,0,0,0,0,0,0,0,0,0,0,0,0,0,0,0,0,0,0,0,0,0,0,0,0,0,0,37.5,18.75,0,0,0,0,0,0,0,0,0,0,0,0,0,0,0,0,0,0,0,0,0,0,0,0,0,0,0,0,0,0,0,0,0,0,0,0,0,0,0,0,0,0,0,0,0,0,0,0,0,0,0,0,0,0,0,0,0,0,0,0,0,0,0,"kilograms",0,0,0,0,0,0,0,0,0,0,0,0,0,0,0,0,0,0.31,0,0,0,0,0,0,0,0,0,0,0,0,0,0,0,0,0,0,0,4.38,0,0,0,0,0,0,0,0,0,0,0,0,0,0,0,0,0,0,0,0,0,0,0,0,0,0,0,0,0,0,0,0,0,0,0,0,0,0,0,0,0,0,0,0,0,0,0,0,0,0.63,0,0,0,68,"celsius",30,18,"celsius","Lycii Berries: 7.5g at end, Ginseng: 5.625g at end, Guarana: 25g at end, Kolabu: 25g at end, Gingko: 6.25g at end, Matcha Tea: 12.5g at end, Maca Powder: 16.25g at end",NA,NA,NA,NA,NA,NA,NA,NA,NA,NA,NA,NA
"78",4.6,"11/7/2015",3.36,98,48,"No Label","4.6% Kölsch","nolabel",154,"No Label","Dry Hopped Ko¨lsch.","10/2015","No Label is a postmodern, postgender non-binary brew; the world’s first beer made with transgender hops. Brewed with whole hop bines that have spontaneously changed from female to male, no label goes its own way. No Label balances a light, biscuity dryness from the malt base with delicate hints of fruity esters gifted by the fermentation. Finally, dry- hopping adds a layer of new world tropical & pine flavours that add a unique twist to this classic Ko¨lsch style beer. All profits from the sales of this beer were donated to LGBTQI+ events organisers Queerest of the Queer.","https://images.punkapi.com/v2/154.png",4.5,25,1009,1043,10,5,4.2,79.1,20,"liters",25,"liters","Strawberry and basil salad with feta","Lemon baked monkfish","Peach cobbler","Dry hop using a muslin bag in order to give you the best chance at getting the signature Ko¨lsch clarity.","Sam Mason <samjbmason>",NA,NA,0,0,0,0,0,0,0,0,0,0,0,0,0,0,0,0,0,0,0,0,0,0,0,0,0,0,0,0,50,0,0,12.5,0,0,0,0,0,0,0,0,0,0,0,0,0,0,0,0,0,0,0,0,0,0,0,0,0,0,0,0,0,0,0,0,0,0,0,0,0,0,0,0,0,0,0,0,0,0,0,0,0,0,0,0,0,0,0,0,0,0,0,0,0,0,0,0,0,0,0,0,0,0,0,0,0,0,0,0,0,0,0,0,0,0,0,0,0,0,0,0,0,0,0,0,0,0,0,0,0,0,0,0,0,0,0,0,0,0,0,0,0,0,0,0,0,0,0,0,0,0,0,50,0,0,0,0,0,0,0,0,0,0,0,0,0,0,50,2.5,0,0,0,0,0,0,0,0,0,0,0,0,0,0,0,0,0,0,0,0,0,0,0,0,0,0,0,0,0,0,0,0,0,0,0,0,0,0,0,0,0,0,0,0,0,0,0,0,0,0,0,0,0,0,0,0,0,0,0,0,0,0,0,0,0,0,0,0,"kilograms",0,0,0,0,0,0,0,0,0,0,0,0,0,0,0,0,0,0,0,0,0,0,0,0,0,0,0,0,0,0,0,0,0,0,0,0,0,0,0,0,0,0,0,0,0,0,0,0,0,0,0,0,0.25,0,0,0,0,0,0,0,0,0,0,0,0,0,3.13,0,0,0,0,0,0,0,0,0,0,0,0,0,0,0,0,0,0,0,0,0.25,0,0,0,65,"celsius",NA,15,"celsius",NA,NA,NA,NA,NA,NA,NA,NA,NA,NA,NA,NA,NA
"79",4.2,"12/10/2012",3.06,88,43,"Nuns with Guns","4.2% Pilsener","nunswithguns",183,"Nuns With Guns","Dry-Hopped Lager.","11/2012","A dry-hopped Session Pilsner. At 4.2% this amber-hued lager packs a malty punch with toasty Munich character and a light caramel sweetness. From here, things take a sharp turn towards the hoppy flavour, with some serious US citrus packed classic hops.","https://images.punkapi.com/v2/183.png",4.2,25,1012,1044,19,9.5,4.4,72.7,20,"liters",25,"liters","Falafel and hummus pitta wrap","Bratwurst with spicy relish","Strawberry tart","Keep the temperature of the fermentation as close to 12C as possible (or below). This allows the yeast to create a crisper and cleaner beer.","Sam Mason <samjbmason>",NA,NA,0,0,0,0,75,0,0,0,10,0,0,0,0,0,0,0,0,0,0,0,0,0,0,0,0,0,0,0,100,1.25,10,0,0,0,0,0,10,0,0,0,0,0,0,75,0,0,0,10,0,0,0,0,0,0,0,0,0,0,0,0,0,0,0,0,0,0,0,0,0,0,0,0,0,0,0,0,0,0,0,0,0,0,0,0,0,0,0,0,0,0,0,0,0,0,0,0,0,0,0,0,0,0,0,0,0,0,0,0,0,0,0,0,0,0,0,0,0,0,0,0,0,0,0,0,0,0,0,0,0,0,0,0,0,0,0,0,0,0,0,0,0,0,0,0,0,0,0,0,0,0,0,0,0,0,0,0,0,0,0,0,0,0,0,0,0,0,0,0,0,0,0,0,0,0,0,0,0,0,0,0,0,0,0,0,0,0,0,0,0,0,0,0,0,0,0,0,0,0,0,0,0,0,0,0,0,0,0,0,0,0,0,0,0,0,0,0,0,0,0,0,0,0,0,0,0,0,0,0,0,0,0,0,0,0,0,0,"kilograms",0,0,0,0,0,0,0,0,0,0,0,0,0,0,0,0,0,0.25,0,0,0,0,0,0,0,0,0,0,0,0,0,0,0,0,0,0,0,0,0,0,0,0,0,0,0,0,0,0,0,0,0,3.38,0.63,0,0,0,0,0,0,0,0,0,0,0,0,0,0,0,0,0,0,0,0,0,0,0,0,0,0,0,0,0,0,0,0,0,0,0,0,0,0,70,"celsius",NA,16,"celsius",NA,NA,NA,NA,NA,NA,NA,NA,NA,NA,NA,NA,NA
"80",7.5,"11/27/2011",3.4,58,317,"Old World India Pale Ale","7.5% India Pale Ale ","oldworldindiapaleale",176,"Old World India Pale Ale","English India Pale Ale.","10/2011","This recreated the epic IPAs that were sent on monumental ocean voyages from England to India by sea in the 1800s. Medium bodied with a complex malt profile, backed up with intense bitterness and a woodsy, earthy rich English hop character.","https://images.punkapi.com/v2/176.png",7.5,80,1012,1069,50,25,4.4,82.6,20,"liters",25,"liters","Honey glazed ham with spicy roasted carrots","Mature cheddar with spicy chutney","Peach cobbler","In beers like this with a hefty malt bill, it pays to check a spoonful of the mash with some iodine solution. This will indicate if the mash has converted all of the starch into fermentable sugars. If the colour is very dark, just extend the mash rest by 10 mins and check again.","Sam Mason <samjbmason>",NA,NA,0,0,0,0,0,0,0,0,0,0,0,0,0,0,0,0,0,0,0,62.5,50,0,0,0,0,0,0,0,0,0,0,0,0,0,0,0,0,0,0,0,0,0,0,0,0,0,0,0,0,0,0,0,0,0,0,0,0,0,0,0,0,0,0,0,0,0,0,0,0,0,0,0,0,0,0,0,0,0,0,0,0,0,0,0,0,0,0,0,0,0,0,0,0,0,0,0,0,0,0,0,0,0,0,0,50,0,0,0,0,0,0,0,0,0,0,0,0,0,0,0,0,0,0,0,0,0,0,0,0,0,0,0,0,0,0,0,0,0,0,0,0,0,0,0,0,0,0,0,0,0,0,0,0,0,0,0,0,0,0,0,0,0,0,0,0,0,0,0,0,0,0,0,0,0,0,0,0,0,0,0,0,0,0,0,0,0,0,0,0,0,0,0,0,0,0,0,0,0,0,0,0,0,0,0,0,0,0,0,0,0,0,0,0,0,0,0,0,0,0,0,0,0,0,0,0,0,0,0,0,0,0,0,0,0,0,0,"kilograms",0,0,0.25,0,0,0,0,0,0,0,0,0,0,0,0,0,0,0,0,0,0,0,0,0,0,0.25,0,0,0,0,0,0,0,0,0,0,0,0,0,0,0,0,0,0,0,0,0,0,0,0,0,6.25,0,0,0,0,0,0,0,0,0,0,0,0,0,0,0,0,0,0,0,0,0,0,0,0,0,0,0,0,0,0,0,0,0,0,0,0,0,0,0,65,"celsius",NA,22,"celsius",NA,NA,NA,NA,NA,NA,NA,NA,NA,NA,NA,NA,NA
"81",9.5,"11/18/2013",3.88,89,337,"Old World Russian Imperial Stout","9.5% Imperial Stout","oldworldrussianimperialstout",155,"Old World Russian Imperial Stout","Russian Imperial Stout.","10/2011","This Old World Stout perfectly recreates the export stouts of years gone by; brewed to imperial strength to avoid freezing during its journey across the Baltic Sea to snowy Moscow. Full bodied with huge chocolate, coffee and roast flavours, this imperial stout employs a variety of hops to add enough bitterness and hop complexity to balance the huge malt sweetness and rich mocha and molasses flavours.","https://images.punkapi.com/v2/155.png",9.5,80,1014,1075,195,97.5,4.5,81.3,20,"liters",25,"liters","Seared steak with a peppercorn sauce","Strong blue cheese and oatcakes","Chocolate cheesecake","Add the chocolate malt after the mash is complete, at the start of sparging. This will extract flavour and colour, but will prevent the extraction of harsh tannins into the wort.","Sam Mason <samjbmason>",NA,NA,0,0,0,0,0,0,0,0,0,0,0,0,0,0,0,0,0,0,0,0,0,0,0,0,0,0,0,0,0,0,25,0,0,0,0,0,0,0,0,0,0,0,0,0,0,0,0,0,0,0,0,0,0,0,0,0,0,0,0,0,0,0,0,0,0,0,0,0,0,0,0,0,0,0,0,0,0,0,0,0,0,0,0,0,0,0,0,0,0,0,0,0,0,0,0,0,0,0,0,0,0,0,0,0,0,0,0,0,0,0,0,0,0,0,0,0,12.5,25,0,0,0,0,0,0,0,0,0,0,0,0,0,0,0,0,0,0,0,0,0,0,0,12.5,0,0,0,0,0,0,0,0,0,0,0,0,0,0,0,0,0,0,12.5,0,0,0,0,0,0,0,0,0,0,0,0,0,0,0,0,0,0,0,0,0,0,0,0,0,0,0,0,0,0,0,0,0,0,0,0,0,0,0,0,0,0,0,0,0,0,0,0,0,0,0,0,0,0,0,0,0,0,0,0,0,0,0,0,0,0,0,0,0,0,0,0,0,0,0,"kilograms",0,0,0,0,0,0,0,0,0,0,0,0,0,0,0,0.31,0,0.31,0,0,0,0.07,0,0,0,0,0,0,0,0.66,0,0,0,0,0,6.56,0,0,0,0,0,0,0,0,0,0,0,0,0,0,0,0,0,0,0,0,0,0,0,0,0,0,0,0,0,0,0,0,0,0,0,0,0,0,0,0,0,0,0,0,0,0,0,0,0,0,0,0,0,0,0,64,"celsius",90,19,"celsius",NA,NA,NA,NA,NA,NA,NA,NA,NA,NA,NA,NA,NA
"82",13.8,"3/8/2015",3.78,77,43,"Paradox Islay","13.8% Imperial Stout","paradoxislay",52,"Paradox Islay","Ubiquitous Imperial Stout.","04/2007","In 2006 James and Martin hijacked a beer dinner run by Michael Jackson, the acclaimed beer and whisky writer, and convinced him to taste one of their home brews. This was a defining moment in BrewDog prehistory, and that beer was the first incarnation of the ubiquitous Paradox. Aged in a variety of casks over the years, Paradox is dark, decadent and encapsulating. Can be enjoyed fresh; phenomenal when aged.","https://images.punkapi.com/v2/52.png",10,55,1014,1090,300,152,4.4,84.4,20,"liters",25,"liters","Ancho chilli beef taco","Chocolate gateaux","Rum poached pears with dark chocolate sauce","The beauty of this beer is in how brilliantly it lends itself to infusing or ageing. Experiment with different additions when the beer is ageing, taste it regularly to gauge its progress, and make sure you package it at its peak.","Sam Mason <samjbmason>",NA,NA,0,0,0,0,0,0,0,0,0,0,0,0,0,0,0,0,0,0,0,0,0,0,0,0,0,0,0,0,0,0,0,0,0,0,0,0,0,0,0,0,0,0,0,0,0,0,0,0,0,0,0,0,0,0,0,0,0,0,0,0,0,0,0,0,0,0,0,0,0,75,0,25,0,0,0,0,0,0,0,0,0,0,0,0,0,0,0,0,0,0,0,0,0,0,0,0,0,0,0,0,0,0,0,0,25,0,0,0,0,0,0,0,0,0,0,0,0,0,0,0,0,0,0,0,0,0,0,0,0,0,0,0,0,0,0,0,0,0,0,0,0,0,0,0,0,0,0,0,0,0,0,0,0,0,0,0,0,0,0,0,0,0,0,0,0,0,0,0,0,0,0,0,0,0,0,0,0,0,0,0,0,0,0,0,0,0,0,0,0,0,0,0,0,0,0,0,0,0,0,0,0,25,0,0,0,0,0,0,0,0,0,0,0,0,0,0,0,0,0,0,0,0,0,0,0,0,0,0,0,0,0,0,0,0,0,0,"kilograms",0,0,0,0,0,0,0,0,0,0,0,0,0,0.18,0,0.33,0,0.55,0,0,0,0,0,0,0,0,0,0,0.55,0,0,0,0,0,0,4.5,0,0,0,0,0,0,0,0,1.35,0,0,0,0,0,0,0,0.33,0,0,0,0,0,0,0,0,0,0,0,0,0,0,0,0,0,0,0,0,0,0,0,0,0,0,0,0,0,0,0,0,0,0,0,0,0,0,65,"celsius",90,21,"celsius","Try ageing on oak chips, infusing with rum raisins, or vanilla pods",NA,NA,NA,NA,NA,NA,NA,NA,NA,NA,NA,NA
"83",15,"1/2/2012",3.9,91,330,"Paradox Jura","15% Imperial Stout","paradoxjura",188,"Paradox Jura","Ubiquitous Imperial Stout.","06/2010","Paradox. Reloaded. In 2011 we put Paradox into high gear to create an Imperial Stout destined for ageing. Loaded with dark roasted malts for a full bodied, toasted background, an array of bitter, earthy and resinous hops, and brewed with oats for a bold mouthfeel. This beer is the perfect canvas for barrel ageing.","https://images.punkapi.com/v2/188.png",10,55,1014,1128,300,152,4.4,89,20,"liters",25,"liters","Smoked cured beef","Smoked aubergine tapenade with rye bread","Beer affogato - 1/3 glass of Paradox with a scoop of vanilla ice cream","Allow the fermentation to go as far as possible. Soak oak chips in whisky to get the barrel aged characteristic.","Sam Mason <samjbmason>",NA,NA,0,0,0,0,0,0,0,0,0,0,0,0,0,0,0,0,0,0,0,0,0,0,0,0,0,0,0,0,0,0,0,0,0,0,0,0,0,0,0,0,0,0,0,0,0,0,0,0,0,0,0,0,0,0,0,0,0,0,0,0,0,0,0,0,0,0,0,0,0,75,0,25,0,0,0,0,0,0,0,0,0,0,0,0,0,0,0,0,0,0,0,0,0,0,0,0,0,0,0,0,0,0,0,0,25,0,0,0,0,0,0,0,0,0,0,0,0,0,0,0,0,0,0,0,0,0,0,0,0,0,0,0,0,0,0,0,0,0,0,0,0,0,0,0,0,0,0,0,0,0,0,0,0,0,0,0,0,0,0,0,0,0,0,0,0,0,0,0,0,0,0,0,0,0,0,0,0,0,0,0,0,0,0,0,0,0,0,0,0,0,0,0,0,0,0,0,0,0,0,0,0,25,0,0,0,0,0,0,0,0,0,0,0,0,0,0,0,0,0,0,0,0,0,0,0,0,0,0,0,0,0,0,0,0,0,0,"kilograms",0,0,0,0,0,0,0,0,0,0,0,0,0,0.25,0,0.5,0,0.86,0,0,0,0,0,0,0,0,0,0,0.86,0,0,0,0,0,0,6.5,0,0,0,0,0,0,0,0,2,0,0,0,0,0,0,0,0.5,0,0,0,0,0,0,0,0,0,0,0,0,0,0,0,0,0,0,0,0,0,0,0,0,0,0,0,0,0,0,0,0,0,0,0,0,0,0,65,"celsius",90,21,"celsius","Try ageing on oak chips, infusing with rum raisins, or vanilla pods",NA,NA,NA,NA,NA,NA,NA,NA,NA,NA,NA,NA
"84",9,"7/17/2015",3,NA,1,"Peach Therapy","9% Abbey Tripel","peachtherapy",102,"Peach Therapy","Tart Belgian Tripple.","06/2015","9% abv sour tripel, infused with peach and apricot in collaboration with some of our favourite beer writers Adrian Tierney-Jones, Matt Curtis and Jonny and Brad from The Craft Beer Channel.","https://images.punkapi.com/v2/keg.png",9,30,1000,1071,12,6,3.6,87,20,"liters",25,"liters","Summer salad with pickled veg","Sticky barbecue spare ribs","Blueberry and almond tart","20% of the original volume of wort was brewed again, kettle soured and added during fermentation to give a tart finish to the beer.","Sam Mason <samjbmason>",NA,NA,0,0,0,0,0,0,0,0,0,0,0,0,0,0,0,0,0,0,0,0,0,0,0,0,0,0,0,0,0,0,0,0,0,0,0,0,0,0,0,0,0,0,0,0,0,0,0,0,0,0,0,0,0,0,0,0,0,0,0,0,0,0,0,0,0,0,0,0,0,0,0,0,0,0,0,0,0,0,0,0,0,0,0,0,0,0,0,0,0,0,0,0,0,0,0,0,0,0,0,0,0,0,0,0,0,0,0,0,0,0,0,0,0,0,0,0,0,0,0,0,0,0,0,0,0,0,0,0,0,0,0,0,0,0,0,0,0,0,0,0,0,0,0,0,0,0,0,0,0,0,0,0,0,0,0,0,0,0,0,0,0,0,0,7.5,25,0,0,0,0,0,0,0,0,0,0,0,0,0,0,0,0,0,0,0,0,0,0,0,0,0,0,0,0,0,0,0,0,0,0,0,0,0,0,0,0,0,0,0,0,0,0,0,0,0,0,7.5,25,0,0,0,0,0,0,0,0,0,0,0,0,0,0,0,0,0,0,0,"kilograms",0,0,0,0,0,0,0,0,0,0,0,0,0,0,0,0,0,0,0,0,0,0,0,0,0,0,0,0,0,0,0,0,0,0,0,14.5,0,0,0,0,0,0,0,0,0,0,0,0,0,0,0,0,0,0,0,0,0,0,0,0,0,0,0,0,0,0,0,0,0,0,0,0,0,0,0,0,0,0,0,0,0,0,0,0,0,0,0,0,0,0,0,NA,NA,NA,20,"celsius",NA,60,65,72,78,"celsius","celsius","celsius","celsius",10,30,10,5
"85",9.3,"5/31/2010",3.17,89,21,"Prototype 27","9.3% Fruit Beer","prototype27",57,"Prototype 27","Vibrant Smoky Pink IPA.","04/2010","Hardcore IPA with raspberries aged in Caol Ila casks. Full-bodied and compelling, the robust malt base provides an initial layer of honey, cinnamon and biscuity malt sweetness. Soon the Scottish berries are in on the act, a dominating tug of war between sweet and tart with an overbearing zest. As the beer slips back across your tongue the hops demand and definitely get your attention. At 100 IBUs the bitterness smashes into the back of your throat as the resinous, spiced orange peel flavours add depth to the berry fruitiness.","https://images.punkapi.com/v2/57.png",9.2,149,1014,1083,19.5,9.8,4.4,83,20,"liters",25,"liters","Strong blue cheese","Cranachan","Chicago style hot links","Soak some oak chips in Caol Ila whisky to get barrel character. Freeze raspberries before adding them to secondary.","Sam Mason <samjbmason>",NA,NA,0,0,0,0,0,0,0,0,0,0,0,0,0,0,0,0,0,0,0,0,0,0,0,0,0,0,0,0,0,0,0,0,0,0,0,50,37.5,12.5,0,0,0,0,0,0,0,0,0,0,0,0,0,0,0,0,0,0,0,0,0,0,0,0,0,0,0,0,0,0,0,50,37.5,12.5,0,0,0,0,0,0,0,0,0,0,0,0,0,0,0,0,0,0,0,0,0,0,0,0,0,0,0,0,0,0,0,0,0,0,0,0,0,0,0,0,0,0,0,0,0,0,0,0,0,0,0,0,0,0,0,0,0,0,0,0,0,0,0,0,0,0,0,0,0,0,0,0,0,0,0,0,0,0,0,0,0,0,0,0,0,0,0,0,0,0,0,0,0,0,0,0,0,0,0,0,0,0,0,0,0,0,0,0,0,0,0,0,0,0,0,0,0,0,0,0,0,0,0,0,0,0,0,0,0,0,0,0,0,0,0,0,37.5,0,0,0,0,0,0,0,0,0,0,0,0,0,0,0,0,0,0,0,0,0,0,0,0,0,0,0,"kilograms",0,0,0,0,0,0,0,0,0,0,0,0,0,0,0,0,0,0.56,0,0,0,0,0,0,0,0,0,0.28,0,0,0,0,0,0,0,0,0,0,0,0,0,0,0,0,0,0,0,0,0,0,0,0,0,0,0,0,0,0,0,0,8.13,0,0,0,0,0,0,0,0,0,0,0,0,0,0,0,0,0,0,0,0,0,0,0,0,0,0,0,0,0,0,65,"celsius",90,19,"celsius",NA,NA,NA,NA,NA,NA,NA,NA,NA,NA,NA,NA,NA
"86",6,"8/16/2009",3.55,86,81,"Punk Monk","6% India Pale Ale ","punkmonk",121,"Punk Monk","Who Ordered The Belgian Yeast?","07/2009","Old world meets new in this trans-atlantic mash up of brewing ingredients. Belgian funk incorporates itself into the pithy, resin and grapefruit, with pineapple and banana rounding out a rambunctious avalanche of fruity hops.","https://images.punkapi.com/v2/keg.png",6,60,1010,1056,17,8.5,4.4,82.1,20,"liters",25,"liters","Moules frites","Thai green curry","Lemon posset","Bottle condition and prime with a little bit more sugar than usual to attain those authentic fine Belgian bubbles.","Sam Mason <samjbmason>",NA,NA,0,17.5,17.5,0,0,0,0,0,0,0,0,0,0,0,0,0,0,0,0,0,0,0,0,0,0,0,0,0,0,0,0,0,0,0,0,0,0,0,0,0,0,0,0,30,0,0,15,17.5,17.5,0,0,0,0,0,0,0,0,0,0,0,0,0,0,0,0,0,0,0,0,0,0,0,0,0,0,0,0,0,17.5,0,0,0,0,0,0,0,0,0,0,0,0,0,0,0,0,0,0,0,0,0,0,0,0,0,0,0,0,0,0,0,0,0,0,0,0,0,0,0,0,0,0,0,0,0,0,0,0,0,0,0,0,0,0,0,0,0,0,0,0,0,0,0,0,0,0,0,0,0,0,0,0,0,0,0,0,0,0,0,0,0,0,0,0,0,0,0,0,0,0,0,0,0,17.5,0,0,0,0,0,0,0,0,0,0,0,0,0,0,0,0,0,0,0,0,0,0,0,0,0,0,0,0,0,0,0,0,0,0,0,0,0,0,0,0,0,0,0,0,0,0,0,0,0,0,0,0,0,0,0,0,0,0,0,0,0,0,0,"kilograms",0,0,0,0,0,0,0,0,0,0,0,0,0,0,0,0,0,0,0,0,0,0,0,0,0,0,0,0,0,0,0,0,0,0,0,5.3,0,0,0,0,0,0,0,0,0,0,0,0,0,0,0,0,0,0,0,0,0,0,0,0,0,0,0,0,0,0,0,0,0,0,0,0,0,0,0,0,0,0,0,0,0,0,0,0,0,0,0,0,0,0,0,65,"celsius",75,19,"celsius",NA,NA,NA,NA,NA,NA,NA,NA,NA,NA,NA,NA,NA
"87",10.27,"4/28/2011",3.28,56,27,"Rabiator","10.27% Weizen Bock","rabiator",20,"Rabiator","Imperial Wheat Beer","03/2011","Imperial Wheat beer / Weizenbock brewed by a homesick German in leather trousers. Think banana bread, bubble gum and David Hasselhoff.","https://images.punkapi.com/v2/keg.png",10.27,26,1014,1092,24,12,4.4,85,20,"liters",25,"liters","Grilled portabello mushroom burger","Chicken sausages with creamy mash","Caramel and banana meringue pie","If you are struggling to get that authentic head retention increase your mash temperature to about 70°C.","Sam Mason <samjbmason>",NA,NA,0,0,0,0,0,0,0,0,0,0,0,0,0,0,0,0,0,0,0,0,0,0,0,0,0,0,0,0,0,0,0,0,0,0,0,0,0,0,0,0,0,0,0,0,0,0,0,0,0,0,0,0,0,0,0,0,0,0,0,0,0,0,0,0,0,0,0,0,0,12.5,0,0,0,0,0,0,0,0,0,0,0,0,0,0,0,0,0,0,0,0,0,0,0,0,0,0,0,0,0,0,0,0,0,0,0,0,0,0,0,0,0,0,0,0,0,0,0,0,0,0,0,0,0,0,0,0,0,0,0,0,0,0,0,0,0,0,0,0,0,0,0,0,0,0,0,12.5,0,0,0,0,0,0,0,0,0,0,0,0,0,0,0,0,0,0,0,0,0,0,0,0,0,0,0,0,0,0,0,0,0,0,0,0,0,0,0,0,0,0,0,0,0,0,0,0,0,0,0,0,0,0,0,0,0,0,0,0,0,0,0,0,0,0,0,0,0,0,0,0,0,0,0,0,0,0,0,0,0,0,0,0,0,0,0,0,0,0,"kilograms",0,0,0,0,0,0,0,0,0,0,0,0,0,0,0,0,0,0,0,0,0,0,0,0.63,0,0,0,0,0,0,0,0,0,0,0,5.63,0,0,0,0,0,0,0,0,0,0,0,0,0,0,0,0,0,0,0,0,0,0,0,0,0,0,0,0,0,0,0,0,0,0,0,0,0,0,0,0,0,0,0,0,0,0,0,0,0,0,0,0.69,0,0,0,64,"celsius",60,21,"celsius",NA,NA,NA,NA,NA,NA,NA,NA,NA,NA,NA,NA,NA
"88",8.7,"3/4/2015",3.73,90,209,"Restorative Beverage For Invalids and Convalescents","8.7% Imperial IPA","restorativebeverageforinvalidsandconvalescents",160,"Restorative Beverage For Invalids And Convalescents","An Extract Taken From \A Treatise on Food and Diet\ By Dr Jonathan Pereira, 1843.","02/2015","Brewed to 8.5%, light as a mass market Pilsner in colour, fermented to be as dry as a Lambic, but as bitter as any double IPA and loaded with as much hop aroma as we can get into a beer. The fermentables in this beer were Maris Otter Extra Pale along with plenty of sugar as we mashed at a very low temperature to ensure maximum fermentability and attenuation. This beer is fermented within an inch of its life making it dry, sheer and bright. Citra, Amarillo & Centennial were all used in abundance in the kettle and also fired extremely liberally at this beer with our high tech hop cannon.","https://images.punkapi.com/v2/160.png",8.5,100,1003,1068,15,7.5,4.4,95.6,20,"liters",25,"liters","Habanero spicy chicken wings with ranch sauce","Jalapen~o chilli and chicken quesadillas","New York style cheesecake","Allow the mash to sit at lower temperatures for an extended period to convert the maximum amount of starch to fermetable sugars. This will give the beer a higher ABV and dry it out.","Sam Mason <samjbmason>",NA,NA,0,0,0,0,100,0,0,0,37.5,0,0,0,0,0,0,0,0,0,0,0,0,0,0,0,0,0,0,10,0,0,0,0,0,100,0,0,37.5,0,0,0,0,0,0,0,0,0,0,0,0,100,0,0,0,0,37.5,0,0,0,0,0,0,0,0,0,0,0,0,0,0,0,0,0,0,0,0,0,0,0,0,0,0,0,0,0,0,0,0,0,0,0,0,0,0,0,0,0,0,0,0,0,0,0,0,0,0,0,0,0,0,0,0,0,0,0,0,0,0,0,0,0,0,0,0,0,0,0,0,0,0,0,0,0,0,0,0,0,0,0,0,0,0,0,0,0,0,0,0,0,0,0,0,0,0,0,0,0,0,0,0,0,0,0,0,0,0,0,0,0,0,0,0,0,0,0,0,0,0,0,0,0,0,0,0,0,0,0,0,0,0,0,0,0,0,0,0,0,0,0,0,0,0,0,0,0,0,0,0,0,0,0,0,0,0,0,0,0,0,0,0,0,0,0,0,0,0,0,0,0,0,0,0,0,0,0,0,0,"kilograms",0,0,0,0,0,0,0,0,0,0,0,0,0,0,0,0,0,0,0,0,0,0,0,0,0,0,0,0,0,0,0,0,0,0,0,0,0,0,0,0,0,0,0,0,0,0,0,0,0,0,0,5.25,0,0,0,0,0,0,0,0,0,0,0,0,0,0,0,0,0,0,0,0,0,0,0,0,0,0,0,0,0,0,0,0,0,0,0,0,0,0.88,0,63,"celsius",90,21,"celsius",NA,NA,NA,NA,NA,NA,NA,NA,NA,NA,NA,NA,NA
