"ratebeer_ABV","ratebeer_Added","ratebeer_Score","ratebeer_Style.","ratebeer_rank","beer_name.x","ratebeer_beer_type","beer_name2","id","beer_name.y","tagline","first_brewed","description","image_url","abv","ibu","target_fg","target_og","ebc","srm","ph","attenuation_level","volume.value","volume.unit","boil_volume.value","boil_volume.unit","food_pairing1","food_pairing2","food_pairing3","brewers_tips","contributed_by","food_pairing4","food_pairing","Hop.ahtanum.aroma.dry.hop","Hop.ahtanum.bitter.start","Hop.ahtanum.flavour.end","Hop.ahtanum.flavour.middle","Hop.amarillo.aroma.dry.hop","Hop.amarillo.aroma.end","Hop.amarillo.bitter.start","Hop.amarillo.flavour.dry.hop","Hop.amarillo.flavour.end","Hop.amarillo.flavour.middle","Hop.bay.leaves.aroma.dry.hop","Hop.blackberry.concentrate.flavour.end","Hop.blueberries.flavour.end","Hop.bobek.bitter.start","Hop.bobek.flavour.end","Hop.bobek.flavour.middle","Hop.bramling.cross.aroma.dry.hop","Hop.bramling.cross.aroma.end","Hop.bramling.cross.bitter.middle","Hop.bramling.cross.bitter.start","Hop.bramling.cross.flavour.end","Hop.bramling.cross.flavour.middle","Hop.bramling.cross.flavour.start","Hop.bramling.cross..first.gold.flavour.end","Hop.bravo.bitter.start","Hop.bravo.flavour.end","Hop.bravo.flavour.middle","Hop.c02.extract.bitter.start","Hop.cascade.aroma.dry.hop","Hop.cascade.bitter.start","Hop.cascade.flavour.end","Hop.cascade.flavour.middle","Hop.cascara.flavour.end","Hop.centennial.aroma.dry.hop","Hop.centennial.bitter.middle","Hop.centennial.bitter.start","Hop.centennial.flavour.end","Hop.centennial.flavour.middle","Hop.challenger.aroma.dry.hop","Hop.challenger.aroma.end","Hop.challenger.bitter.start","Hop.challenger.flavour.end","Hop.challenger.flavour.middle","Hop.chinook.aroma.dry.hop","Hop.chinook.aroma.fv","Hop.chinook.bitter.middle","Hop.chinook.bitter.start","Hop.chinook.flavour.end","Hop.chinook.flavour.middle","Hop.citra.aroma.dry.hop","Hop.citra.aroma.fv","Hop.citra.aroma.FV","Hop.citra.bitter.start","Hop.citra.flavouor.end","Hop.citra.flavour.end","Hop.citra.flavour.middle","Hop.co2.extract.bitter.start","Hop.coffee.beans.flavour.end","Hop.coffee.beans.flavour.middle","Hop.coffee.beans.twist.end","Hop.coffee.aroma.dry.hop","Hop.coffee.flavour.end","Hop.coffee.flavour.middle","Hop.coffee.twist.0","Hop.coffee.twist.15","Hop.cold.infused.coffee.flavour.end","Hop.columbus.extract.bitter.start","Hop.columbus.aroma.dry.hop","Hop.columbus.bitter.end","Hop.columbus.bitter.start","Hop.columbus.flavour.end","Hop.columbus.flavour.middle","Hop.comet.aroma.dry.hop","Hop.comet.bitter.start","Hop.comet.flavour.end","Hop.comet.flavour.middle","Hop.coriander.seed.flavour.end","Hop.crystal.flavour.end","Hop.crystal.flavour.middle","Hop.dana.aroma.dry.hop","Hop.dana.bitter.start","Hop.dana.flavour.end","Hop.dana.flavour.middle","Hop.east.kent.goldings.flavour.middle","Hop.el.dorado.aroma.dry.hop","Hop.el.dorado.bitter.start","Hop.el.dorado.flavour.end","Hop.el.dorado.flavour.middle","Hop.elderflower.aroma.dry.hop","Hop.ella.aroma.dry.hop","Hop.ella.bitter.start","Hop.ella.flavour.end","Hop.ella.flavour.middle","Hop.enigma.bitter.start","Hop.enigma.flavour.end","Hop.enigma.flavour.middle","Hop.equinox.aroma.dry.hop","Hop.equinox.bitter.start","Hop.equinox.flavour.end","Hop.equinox.flavour.middle","Hop.exp.366.flavour.middle","Hop.first.gold.aroma...bitter.end","Hop.first.gold.aroma.end","Hop.first.gold.bitter.start","Hop.first.gold.flavour.end","Hop.first.gold.flavour.middle","Hop.fuggles..aroma.0","Hop.fuggles.aroma.end","Hop.fuggles.bitter.15","Hop.fuggles.bitter.start","Hop.fuggles.flavour.end","Hop.fuggles.flavour.middle","Hop.galaxy.aroma.dry.hop","Hop.galaxy.bitter.start","Hop.galaxy.flavour.end","Hop.galena.aroma.dry.hop","Hop.galena.bitter.start","Hop.galena.flavour.end","Hop.galena.flavour.middle","Hop.ginger.powder.flavour.end","Hop.ginger.flavour.end","Hop.goldings.aroma.dry.hop","Hop.goldings.bitter.start","Hop.goldings.flavour.end","Hop.goldings.flavour.middle","Hop.green.bullet.bitter.start","Hop.guarana.powder.flavour.end","Hop.habanero.powder.flavour.end","Hop.hallertauer.mittelfru.h.bitter.start","Hop.hallertauer.mittelfru.h.flavour.middle","Hop.hallertauer.mittelfruh.bitter.start","Hop.hallertauer.mittelfrüh.bitter.start","Hop.hallertauer.mittelfrüh.flavour.middle","Hop.hbc.366.aroma.dry.hop","Hop.hbc.366.bitter.start","Hop.hbc.366.flavour.end","Hop.hbc.366.flavour.middle","Hop.hbc.369.aroma.dry.hop","Hop.hbc.369.bitter.start","Hop.hbc.369.flavour.end","Hop.heather.honey.flavour.end","Hop.hercules.bitter.start","Hop.hercules.flavour.end","Hop.hersbrucker.bitter.start","Hop.hersbrucker.flavour.end","Hop.hersbrucker.flavour.middle","Hop.honey..middle","Hop.honey.flavour.end","Hop.hop.extract.bitter.start","Hop.jasmine.aroma.dry.hop","Hop.jasmine.flavour.end","Hop.jester.flavour.end","Hop.juniper.berries.aroma.dry.hop","Hop.kohatu.aroma.dry.hop","Hop.kohatu.bitter.start","Hop.kohatu.flavour.end","Hop.kohatu.flavour.middle","Hop.kola.nut.powder.flavour.end","Hop.lactose..middle","Hop.liberty.flavour.end","Hop.magnum.bitter.start","Hop.magnum.flavour.end","Hop.magnum.flavour.middle","Hop.mandarina.bavaria.bitter.start","Hop.mandarina.bavaria.flavour.end","Hop.mandarina.bavaria.flavour.middle","Hop.mosaic.aroma.dry.hop","Hop.mosaic.bitter.start","Hop.mosaic.flavour.end","Hop.mosaic.flavour.middle","Hop.motueka.aroma.dry.hop","Hop.motueka.bitter.start","Hop.motueka.flavour.end","Hop.motueka.flavour.middle","Hop.mt.hood.flavour.end","Hop.mt.hood.flavour.middle","Hop.nelson.sauvin.aroma.dry.hop","Hop.nelson.sauvin.aroma.end","Hop.nelson.sauvin.bitter.start","Hop.nelson.sauvin.flavour.end","Hop.nelson.sauvin.flavour.middle","Hop.nugget.bitter.start","Hop.nz.nelson.sauvin.aroma.dry.hop","Hop.orange.peel.flavour.end","Hop.pacific.gem.flavour.end","Hop.pacific.hallertau.bitter.start","Hop.pacific.hallertau.flavour.end","Hop.pacific.jade.aroma.dry.hop","Hop.pacific.jade.flavour.end","Hop.pacifica.aroma.dry.hop","Hop.pacifica.flavour.end","Hop.peppercorns.flavour.middle","Hop.perle.aroma.end","Hop.perle.bitter.start","Hop.perle.flavour.middle","Hop.pioneer.bitter.start","Hop.pioneer.flavour.end","Hop.pioneer.flavour.middle","Hop.poppy.seed.flavour.end","Hop.rosemary.aroma.dry.hop","Hop.saaz.bitter.start","Hop.saaz.flavour.end","Hop.saaz.flavour.middle","Hop.simcoe.aroma.dry.hop","Hop.simcoe.aroma.end","Hop.simcoe.bitter.middle","Hop.simcoe.bitter.start","Hop.simcoe.flavour.dry.hop","Hop.simcoe.flavour.end","Hop.simcoe.flavour.middle","Hop.sorachi.ace.aroma.dry.hop","Hop.sorachi.ace.bitter.start","Hop.sorachi.ace.flavour.end","Hop.sorachi.ace.flavour.middle","Hop.sour.cherry.puree.flavour.end","Hop.strisselspalt.bitter.start","Hop.strisselspalt.flavour.end","Hop.styrian.goldings.flavour.end","Hop.tettnang.flavour.middle","Hop.tomahawk.aroma.dry.hop","Hop.tomahawk.bitter.start","Hop.tomahawk.flavour.end","Hop.waimea.aroma.dry.hop","Hop.waimea.bitter.start","Hop.waimea.flavour.end","Hop.waimea.flavour.middle","Hop.vic.secret.aroma.dry.hop","Hop.vic.secret.bitter.start","Hop.vic.secret.flavour.end","Hop.vic.secret.flavour.middle","Hop.willamette.aroma.dry.hop","Hop.willamette.aroma.end","Hop.willamette.bitter.end","Hop.willamette.bitter.start","Hop.willamette.flavour.end","Hop.willamette.flavour.middle","malt_unit","Malt.acidulated.malt","Malt.acidulated.malt.for.kettle.souring","Malt.amber","Malt.black","Malt.black.malt","Malt.black.patent","Malt.brown","Malt.cane.sugar","Malt.cara","Malt.caraaroma","Malt.carafa.1","Malt.carafa.2","Malt.carafa.3","Malt.carafa.special.malt.type.1","Malt.carafa.special.malt.type.2","Malt.carafa.special.malt.type.3","Malt.carahell","Malt.caramalt","Malt.caramunich","Malt.carared","Malt.cascara","Malt.chocolate","Malt.chocolate.malt","Malt.crystal","Malt.crystal.120","Malt.crystal.150","Malt.crystal.malt","Malt.crystal.malt.150","Malt.dark.crystal","Malt.dark.crystal.350","Malt.dark.crystal.350.400","Malt.dark.muscavado..wort.kettle.","Malt.dextrin.malt","Malt.dextrose","Malt.drc","Malt.extra.pale","Malt.extra.pale...maris.otter","Malt.extra.pale...spring.blend","Malt.extra.pale...sprint.blend","Malt.extra.pale.ale.malt","Malt.extra.pale.maris.otter","Malt.extra.pale.spring.blend","Malt.flaked.malted.oats","Malt.flaked.oat.malt","Malt.flaked.oats","Malt.ginger.root","Malt.honey","Malt.lactose","Malt.lager","Malt.lager.malt","Malt.maris.otter","Malt.maris.otter.extra.pale","Malt.munich","Malt.oats","Malt.organic.caramalt","Malt.organic.chocolate","Malt.organic.lager","Malt.organic.munich","Malt.pale.ale","Malt.pale.ale...tipple","Malt.pale.ale.malt","Malt.pale.chocolate","Malt.pale.crystal","Malt.pale.crystal.60","Malt.pale.malt","Malt.peated.malt","Malt.pilsner","Malt.pinhead.oats","Malt.popcorn","Malt.premium.eng.caramalt","Malt.propino.pale.malt","Malt.propino.pale.malt.for.kettle.0.03kg.souring","Malt.propino.pale.malt.for.kettle.souring","Malt.roast.barley","Malt.roasted.barley","Malt.roasted.malt","Malt.rye","Malt.rye.malt","Malt.smoked","Malt.smoked.malt","Malt.smoked.peaty","Malt.smoked.warminster","Malt.smoked.weyermann","Malt.special.w","Malt.torrified.wheat","Malt.weyermann.beech.smoked","Malt.weyermann.smoked","Malt.wheat","Malt.wheat.malt","Malt.white.cane.sugar","Malt.xpale","mash_temp.temp.value","mash_temp.temp.unit","mash_temp.duration","fermentation.temp.value","fermentation.temp.unit","twist","mash_temp.temp.value1","mash_temp.temp.value2","mash_temp.temp.value3","mash_temp.temp.value4","mash_temp.temp.unit1","mash_temp.temp.unit2","mash_temp.temp.unit3","mash_temp.temp.unit4","mash_temp.duration1","mash_temp.duration2","mash_temp.duration3","mash_temp.duration4"
"1",7.5,"5/29/2013",3.55,98,257,"#MashTag 2013","7.5% Brown Ale","mashtag2013",76,"#Mashtag 2013","Democratic American Brown Ale.","05/2013","A rich, nutty Brown Ale with a deep, rich malt profile, hopped with a range of citrusy and spicy US varieties. Mellow yet endlessly complex, with enough chocolate and fruit character to balance the bitterness, and a soft oaky roundness.","https://images.punkapi.com/v2/76.png",7.5,50,1013,1070,40,20,4.4,81.4,20,"liters",25,"liters","Roast beef","Roasted butternut squash","Hazelnut brittle","Add the hazelnuts and oak chips during the cold conditioning phase.","Sam Mason <samjbmason>",NA,NA,0,0,0,0,0,0,0,0,5,6,0,0,0,0,0,0,0,0,0,0,0,0,0,0,0,0,0,0,0,0,5,6,0,0,0,0,0,0,0,0,0,0,0,0,0,0,0,0,0,0,0,0,0,0,0,0,0,0,0,0,0,0,0,0,0,0,0,0,0,0,0,0,0,0,0,0,0,0,0,0,0,0,0,0,0,0,0,0,0,0,0,0,0,0,0,0,0,0,0,0,0,0,0,0,0,0,0,0,0,0,0,0,0,0,0,0,0,0,0,0,0,0,0,0,0,0,0,0,0,0,0,0,0,0,0,0,0,0,0,0,0,0,0,0,0,0,0,0,0,0,0,0,0,0,0,0,0,0,0,0,12.5,0,0,0,0,0,0,0,0,0,0,10,0,0,0,0,0,0,0,0,0,0,0,0,0,0,0,0,0,0,0,0,0,0,0,0,0,0,0,0,0,0,0,0,0,0,0,0,0,0,0,0,0,0,0,0,0,0,0,0,0,0,0,0,0,0,0,0,0,0,0,0,0,0,5,0,"kilograms",0,0,0.25,0,0,0,0,0,0,0,0,0,0,0,0,0,0,0.44,0,0,0,0.19,0,0,0,0,0,0,0.5,0,0,0,0,0,0,5,0,0,0,0,0,0,0,0,0,0,0,0,0,0,0,0,0,0,0,0,0,0,0,0,0,0,0,0,0,0,0,0,0,0,0,0,0,0,0,0,0,0,0,0,0,0,0,0,0,0,0,0,0,0,0,65,"celsius",90,21,"celsius","Roasted Hazelnuts: 25g in Tank (FV), Almonds: 12.5g in Tank (FV), Oak Chips: 25g in Tank (FV)",NA,NA,NA,NA,NA,NA,NA,NA,NA,NA,NA,NA
"2",9,"6/4/2014",3.68,89,210,"#MashTag 2014","9% American Strong Ale","mashtag2014",136,"#Mashtag 2014","Democratic Imperial Red Ale.","05/2014","A slightly psychotic, orange-that- thinks-it’s-a-grapefruit character builds upon and intensifies the hop bitterness, squaring up against the rich sweet malt base. The result is a huge Red Ale with a drinkable quality you’d expect in a beer half this strength.","https://images.punkapi.com/v2/136.png",9,50,1015,1084,20,10,4.4,82.1,20,"liters",25,"liters","Beetroot and blood orange salad","Coriander and mango grilled steak tacos","Orange sherbet ice cream","Experiment with different citrus juices to get a wide array of flavours and aromas in the beer.","Sam Mason <samjbmason>",NA,NA,0,0,0,0,57.5,0,0,0,19,19,0,0,0,0,0,0,0,0,0,0,0,0,0,0,0,0,0,0,0,0,0,0,0,57.5,0,0,0,0,0,0,0,0,0,0,0,0,0,0,0,0,0,0,0,0,0,0,0,0,0,0,0,0,0,0,0,0,0,0,0,0,0,0,0,0,0,0,0,0,0,0,0,0,0,0,0,0,0,0,0,0,0,0,0,0,0,0,0,0,0,0,0,0,0,0,0,0,0,0,0,0,0,0,0,0,0,0,0,0,0,0,0,0,0,0,0,0,0,0,0,0,19,0,0,0,0,0,0,0,0,0,0,0,0,0,0,0,0,0,0,0,0,0,0,0,0,0,0,0,0,0,0,0,0,0,0,0,0,0,0,0,0,9.5,28.5,19,0,0,0,0,0,0,0,0,0,0,0,0,0,0,0,0,0,0,0,0,0,0,0,0,0,0,0,0,0,57.5,0,0,0,0,0,0,0,0,0,0,0,0,0,0,0,0,0,0,0,0,0,0,0,0,0,0,0,0,0,0,0,0,"kilograms",0,0,0,0,0,0,0,0,0,0,0,0,0,0,0,0,0,0.38,0,0,0,0.1,0,0,0,0.58,0,0,0,0,0,0,0,0,0,7.5,0,0,0,0,0,0,0,0,0,0,0,0,0,0,0,0,0,0,0,0,0,0,0,0,0,0,0,0,0,0,0,0,0,0,0,0,0,0,0,0,0,0,0,0,0,0,0,0,0,0,0,0,0,0,0,65,"celsius",75,21,"celsius","Blood Orange: 250g at end, Lemon Peel: 3.9g at end, Orange Peel: 7.7g at end",NA,NA,NA,NA,NA,NA,NA,NA,NA,NA,NA,NA
"3",10,"7/24/2015",3.72,90,223,"#MashTag 2015","10% Barley Wine","mashtag2015",90,"#Mashtag 2015","US Hopped Black Barley Wine.","05/2015","Democratically voted on by you and the BrewDog beer community. A wonderfully burnt toast malt backbone, loaded with American Hops for floral, citrus flavours and warm boozy vanilla and toasted oak.","https://images.punkapi.com/v2/90.png",10,85,1020,1098,130,65,4.4,79.6,20,"liters",25,"liters","Charcuterie platter (featuring Italian salami)","Blue cheese wedge salad","Rich dark chocolate volcano cake","Steep the oak chips and vanilla in separate bags in the cold conditioning phase. Taste every 2 - 3 days and as soon as profile is desirable they can be removed easily.","Sam Mason <samjbmason>",NA,NA,0,0,0,0,0,0,0,0,0,0,0,0,0,0,0,0,0,0,0,0,0,0,0,0,0,0,0,0,0,0,0,0,0,38.5,0,0,19,19,0,0,0,0,0,0,0,0,0,0,0,0,0,0,0,0,0,0,0,0,0,0,0,0,0,0,0,0,0,0,0,38.5,0,0,0,0,0,0,0,0,0,0,0,0,0,0,0,0,0,0,0,0,0,0,0,0,0,0,0,0,0,0,0,0,0,0,0,0,0,0,0,0,0,0,0,0,0,0,0,0,0,0,0,0,0,0,0,0,0,0,0,0,0,0,0,0,0,0,0,0,0,0,0,0,0,0,0,0,0,0,0,0,0,0,0,0,0,0,0,0,0,0,0,0,0,0,0,0,0,0,0,0,0,0,0,0,0,0,0,0,0,0,0,19,0,0,0,0,0,0,0,0,0,0,0,0,0,0,0,0,0,0,0,0,0,38.5,0,0,0,0,19,19,0,0,0,0,0,0,0,0,0,0,0,0,0,0,0,0,0,0,0,0,38.5,0,0,0,19,0,"kilograms",0,0,0,0,0,0,0,0,0,0,0,0,0,0.38,0,0.19,0,0.96,0,0,0,0,0,0,0,0,0,0,0,0,0,0,0,0,0,0,0,0,0,0,0,0,0,0,0,0,0,0,0,0,0,0,0.77,0,0,0,0,0,0,0,6.35,0,0,0,0,0,0,0,0,0,0,0,0,0,0,0,0,0,0,0,0,0,0,0.29,0,0,0,0,0,0,0,65,"celsius",75,21,"celsius","Oak Chips: 38.5g at FV, Vanilla Pods at FV",NA,NA,NA,NA,NA,NA,NA,NA,NA,NA,NA,NA
"4",7.7,"5/9/2013",3.38,94,102,"10 Heads High","7.7% Amber Ale","10headshigh",29,"10 Heads High","Imperial Red Ale.","04/2013","10 Heads High is loosely based on our awesome 2011 Prototype beer Hops Kill Nazis. This is an uncompromising 7.8% Imperial Red Ale loaded high with American Hops. Think of this as an Imperial India Red Ale, or a super-charged version of 5am Saint. Either way this is a seriously good beer!","https://images.punkapi.com/v2/29.png",7.8,70,1015,1074,90,45,4.4,79.7,20,"liters",25,"liters","Arrabiata pasta","Mulled cheddar","Toasted almond cake","Achieve the red colour by using the ratio of Caramalt, Crystal and Dark Crystal malts. The trick is to get the colour, without too much dried fruit character.","Sam Mason <samjbmason>",NA,NA,0,0,0,0,0,0,0,0,0,0,0,0,0,0,0,0,0,0,0,0,0,0,0,0,0,0,0,0,0,0,0,0,0,0,5,0,62.5,0,0,0,0,0,0,100,0,5,20,62.5,0,0,0,0,0,0,0,0,0,0,0,0,0,0,0,0,0,0,0,0,0,0,0,0,0,0,0,0,0,0,0,0,0,0,0,0,0,0,0,0,0,0,0,0,0,0,0,0,0,0,0,0,0,0,0,0,0,0,0,0,0,0,0,0,0,0,0,0,0,0,0,0,0,0,0,0,0,0,0,0,0,0,0,0,0,0,0,0,0,0,0,0,0,0,0,0,0,0,0,0,0,0,0,0,0,0,0,0,0,0,0,0,0,0,0,0,0,0,0,0,0,0,0,0,0,0,0,0,0,0,0,0,0,0,0,0,0,0,0,0,0,0,0,0,0,0,0,0,0,0,0,0,0,0,0,0,0,0,0,0,0,0,0,0,0,0,0,0,0,0,0,0,0,0,0,0,0,0,0,0,0,0,0,0,0,0,0,0,"kilograms",0,0,0,0,0,0,0,0,0,0,0,0,0,0,0,0,0,1.25,0,0,0,0,0,0,0,0.5,0,0,0.13,0,0,0,0,0,0,4.75,0,0,0,0,0,0,0,0,0,0,0,0,0,0,0,0,0,0,0,0,0,0,0,0,0,0,0,0,0,0,0,0,0,0,0,0,0,0,0,0,0,0,0,0,0,0,0,0,0,0,0,0,0,0,0,65,"celsius",75,18,"celsius",NA,NA,NA,NA,NA,NA,NA,NA,NA,NA,NA,NA,NA
"5",5,"7/23/2009",3.61,99,1756,"5 A.M. Saint","5% Amber Ale","5amsaint",132,"5am Saint","Bittersweet Chaos. Malty. Fruity. Bite.","06/2009","Out of order and stability comes the rush of the pack. Berry and caramel riding alongside marmalade and chocolate. Spice and toast jostle with lychee and biscuit. The needle flicks to all points of the compass. It drives you towards the horizon, towards the vanishing point. And it keeps going...","https://images.punkapi.com/v2/132.png",5,30,1012,1050,60,30.5,4.4,76,20,"liters",25,"liters","Cheddar cheese melt on crisp rye toast","Moroccan chicken tangine","Cheesecake topped with kiwi","Go easy on the crystal and dark crystal malt. Too much will skew the flavour profile away from lychees and citrus towards dried fruit.","Sam Mason <samjbmason>",NA,NA,25,0,0,0,25,0,2.5,0,12.5,0,0,0,0,0,0,0,0,0,0,0,0,0,0,0,0,0,0,0,50,2.5,0,0,0,50,0,0,0,0,0,0,0,0,0,0,0,0,0,0,0,0,0,0,0,0,0,0,0,0,0,0,0,0,0,0,0,0,0,0,0,0,0,0,0,0,0,0,0,0,0,0,0,0,0,0,0,0,0,0,0,0,0,0,0,0,0,0,0,0,0,0,0,0,0,0,0,0,0,0,0,0,0,0,0,0,0,0,0,0,0,0,0,0,0,0,0,0,0,0,0,0,0,0,0,0,0,0,0,0,0,0,0,0,0,0,0,0,0,0,0,0,0,0,0,0,0,0,0,0,0,0,0,0,0,0,0,0,0,0,0,0,0,0,0,0,0,0,12.5,0,0,12.5,2.5,0,0,0,0,0,0,0,0,0,0,0,0,0,0,0,0,0,0,0,0,0,0,25,0,0,0,0,0,0,0,0,0,0,0,0,0,0,0,0,0,0,0,0,0,0,0,0,0,0,0,0,0,0,0,0,"kilograms",0,0,0,0,0,0,0,0,0,0,0,0,0,0,0,0,0,0.88,0,0,0,0,0,0,0,0.38,0,0,0.13,0,0,0,0,0,0,2.56,0,0,0,0,0,0,0,0,0,0,0,0,0,0,0,0,0.63,0,0,0,0,0,0,0,0,0,0,0,0,0,0,0,0,0,0,0,0,0,0,0,0,0,0,0,0,0,0,0,0,0,0,0,0,0,0,62,"celsius",75,19,"celsius",NA,NA,NA,NA,NA,NA,NA,NA,NA,NA,NA,NA,NA
"6",4.9,"1/23/2009",3.14,88,515,"77 Lager","4.9% Premium Lager","77lager",162,"77 Lager","Artisan Rebel Pilsner.","12/2008","Think of everything you know about lagers. Then forget it all instantly. 77 will redefine the experience forever. A Lager that actually tastes of something? You have to be kidding, right? 77 lager is made with 100% malt and whole leaf hops. It contains no preservatives, additives, cheap substitutes or any other junk. Maybe we are crazy. So what? Taste 77 Lager and we are pretty sure you will agree that the fine line between genius and insanity has just become a little more blurred.","https://images.punkapi.com/v2/162.png",4.9,30,1009,1047,12,6,4.4,80.7,20,"liters",25,"liters","Aromatic spicy red thai curry","Sticky spicy barbecue ribs with a strong blue cheese dipping sauce","Creamy warm baked goats cheese salad","Watch out for collecting too much wort. Collecting too much liquid from run off (under 1008) may impart massive and undesired 'grainy' flavours into the beer","Mike Francis <mikeffrancis@gmail.com>",NA,NA,0,0,0,0,0,0,0,0,0,0,0,0,0,0,0,0,0,0,0,0,0,0,0,0,0,0,0,0,0,0,0,0,0,0,0,0,0,0,0,0,0,0,0,0,0,0,0,0,0,0,0,0,0,0,0,0,0,0,0,0,0,0,0,0,0,0,0,0,0,0,0,0,0,0,0,0,0,0,0,0,0,0,0,0,0,0,0,0,0,0,0,0,0,0,0,0,0,0,0,0,0,0,0,0,0,0,0,0,0,0,0,0,0,0,0,0,0,0,0,0,0,0,0,0,0,0,0,0,0,0,0,37.5,25,0,0,0,0,0,0,0,0,0,0,0,0,0,0,0,0,0,0,0,0,0,0,0,0,0,0,0,0,0,0,0,0,0,0,0,0,0,0,0,0,0,0,0,0,0,0,0,0,0,0,0,0,0,0,0,0,0,0,0,0,0,0,0,0,0,0,0,0,25,0,0,0,0,0,0,0,0,0,0,0,0,0,0,0,0,37.5,0,0,0,0,0,0,0,0,0,0,0,0,0,0,0,0,0,"kilograms",0,0,0,0,0,0,0,0,0,0,0,0,0,0,0,0,0,0.31,0,0,0,0,0,0,0,0,0,0,0,0,0,0,0,0,0,3.63,0,0,0,0,0,0,0,0,0,0,0,0,0,0,0,0,0.31,0,0,0,0,0,0,0,0,0,0,0,0,0,0,0,0,0,0,0,0,0,0,0,0,0,0,0,0,0,0,0,0,0,0,0,0,0,0,65,"celsius",75,10,"celsius",NA,NA,NA,NA,NA,NA,NA,NA,NA,NA,NA,NA,NA
"7",4.5,"5/11/2016",3.39,67,183,"Ace of Chinook","4.5% Session IPA","aceofchinook",231,"Ace Of Chinook","Single-Hopped Session IPA.","01/2016","We love hops. We adore and worship their profile ability to transform beer. You could say that we have a terminal addiction. To celebrate this fetish we’re heroing our favourites in single hopped limited releases. No also starring, no extras, no compromise. The Hop is the Hero. A biscuity malty backbone builds to intense resinous pine with pithy citrus notes, culminating in a grapefruit hit and a long bitter finish. Our Ace in the hole, devastatingly singular, deliciously bitter. Serving up an Ace each and every time.","https://images.punkapi.com/v2/231.png",4.5,40,1011,1045,18,9,4.2,75.6,20,"liters",25,"liters","Cheese covered tater tots","Chicago style hot dog","Beignet","Use whole leaf hops for the dry hopping. They’re much easier to get out.","Matt Ball <GeordieMatt>",NA,NA,0,0,0,0,0,0,0,0,0,0,0,0,0,0,0,0,0,0,0,0,0,0,0,0,0,0,0,0,0,0,0,0,0,0,0,0,0,0,0,0,0,0,0,187.5,0,0,3.75,37.5,12.5,0,0,0,0,0,0,0,0,0,0,0,0,0,0,0,0,0,0,0,0,0,0,0,0,0,0,0,0,0,0,0,0,0,0,0,0,0,0,0,0,0,0,0,0,0,0,0,0,0,0,0,0,0,0,0,0,0,0,0,0,0,0,0,0,0,0,0,0,0,0,0,0,0,0,0,0,0,0,0,0,0,0,0,0,0,0,0,0,0,0,0,0,0,0,0,0,0,0,0,0,0,0,0,0,0,0,0,0,0,0,0,0,0,0,0,0,0,0,0,0,0,0,0,0,0,0,0,0,0,0,0,0,0,0,0,0,0,0,0,0,0,0,0,0,0,0,0,0,0,0,0,0,0,0,0,0,0,0,0,0,0,0,0,0,0,0,0,0,0,0,0,0,0,0,0,0,0,0,0,0,0,0,0,0,0,0,0,"kilograms",0,0,0,0,0,0,0,0,0,0,0,0,0,0,0,0,0,0.5,0,0,0,0,0,0,0,0,0,0,0,0,0,0,0,0,0,0,0,0,0,0,0,0,0,0,0,0,0,0,0,0,1.3,0,0,0,0,0,0,0,2.3,0,0,0,0,0,0,0,0,0,0,0,0,0,0,0,0,0,0,0,0,0,0,0,0,0,0,0,0,0,0,0,0,65,"celsius",75,19,"celsius",NA,NA,NA,NA,NA,NA,NA,NA,NA,NA,NA,NA,NA
"8",4.5,"8/17/2016",3.39,65,77,"Ace of Citra","4.5% Session IPA","aceofcitra",233,"Ace Of Citra","Single-Hopped Session IPA.","01/2016","We love hops. We adore and worship their profile ability to transform beer. You could say that we have a terminal addiction. To celebrate this fetish we’re heroing our favourites in single hopped limited releases. No also starring, no extras, no compromise. The Hop is the Hero. A biscuity malty backbone layered with berry and resin, culminating with a lime zest hit and an explosive bitter citrus finish. Our Ace in the hole, devastatingly singular, deliciously bitter. Serving up an Ace each and every time.","https://images.punkapi.com/v2/233.png",4.5,40,1011,1045,18,9,4.2,75.6,20,"liters",25,"liters","Courgette fries","Curried sea bass","Pistachio layer cake","Let the wort sit for 30 minutes after flameout before cooling to get the most out of that last hop addition.","Matt Ball <GeordieMatt>",NA,NA,0,0,0,0,0,0,0,0,0,0,0,0,0,0,0,0,0,0,0,0,0,0,0,0,0,0,0,0,0,0,0,0,0,0,0,0,0,0,0,0,0,0,0,0,0,0,0,0,0,187.5,0,0,3.75,0,37.5,12.5,0,0,0,0,0,0,0,0,0,0,0,0,0,0,0,0,0,0,0,0,0,0,0,0,0,0,0,0,0,0,0,0,0,0,0,0,0,0,0,0,0,0,0,0,0,0,0,0,0,0,0,0,0,0,0,0,0,0,0,0,0,0,0,0,0,0,0,0,0,0,0,0,0,0,0,0,0,0,0,0,0,0,0,0,0,0,0,0,0,0,0,0,0,0,0,0,0,0,0,0,0,0,0,0,0,0,0,0,0,0,0,0,0,0,0,0,0,0,0,0,0,0,0,0,0,0,0,0,0,0,0,0,0,0,0,0,0,0,0,0,0,0,0,0,0,0,0,0,0,0,0,0,0,0,0,0,0,0,0,0,0,0,0,0,0,0,0,0,0,0,0,0,0,0,0,0,0,0,0,0,"kilograms",0,0,0,0,0,0,0,0,0,0,0,0,0,0,0,0,0,0.5,0,0,0,0,0,0,0,0,0,0,0,0,0,0,0,0,0,0,0,0,0,0,0,0,0,0,0,0,0,0,0,0,1.3,0,0,0,0,0,0,0,2.3,0,0,0,0,0,0,0,0,0,0,0,0,0,0,0,0,0,0,0,0,0,0,0,0,0,0,0,0,0,0,0,0,65,"celsius",75,19,"celsius",NA,NA,NA,NA,NA,NA,NA,NA,NA,NA,NA,NA,NA
"9",4.5,"11/11/2016",3.38,63,61,"Ace of Equinox","4.5% Session IPA","aceofequinox",232,"Ace Of Equinox","Single-Hopped Session IPA.","01/2016","We love hops. We adore and worship their profile ability to transform beer. You could say that we have a terminal addiction. To celebrate this fetish we’re heroing our favourites in single hopped limited releases. No also starring, no extras, no compromise. The Hop is the Hero. A biscuity malty backbone builds to intense tropical fruit, with bitter resin notes, culminating with an explosive papya hit and a long bitter finish. Our Ace in the hole, devastatingly singular, deliciously bitter. Serving up an Ace each and every time.","https://images.punkapi.com/v2/232.png",4.5,40,1011,1045,18,9,4.2,75.6,20,"liters",25,"liters","Chicken, mango and chili salad","Deep fried coconut prawns","Pineapple upside down cake","If you are struggling with the malt hop balance, try upping the speciality malt a little bit until you hit your sweet spot.","Matt Ball <GeordieMatt>",NA,NA,0,0,0,0,0,0,0,0,0,0,0,0,0,0,0,0,0,0,0,0,0,0,0,0,0,0,0,0,0,0,0,0,0,0,0,0,0,0,0,0,0,0,0,0,0,0,0,0,0,0,0,0,0,0,0,0,0,0,0,0,0,0,0,0,0,0,0,0,0,0,0,0,0,0,0,0,0,0,0,0,0,0,0,0,0,0,0,0,0,0,0,0,0,0,0,0,187.5,3.75,37.5,10,0,0,0,0,0,0,0,0,0,0,0,0,0,0,0,0,0,0,0,0,0,0,0,0,0,0,0,0,0,0,0,0,0,0,0,0,0,0,0,0,0,0,0,0,0,0,0,0,0,0,0,0,0,0,0,0,0,0,0,0,0,0,0,0,0,0,0,0,0,0,0,0,0,0,0,0,0,0,0,0,0,0,0,0,0,0,0,0,0,0,0,0,0,0,0,0,0,0,0,0,0,0,0,0,0,0,0,0,0,0,0,0,0,0,0,0,0,0,0,0,0,0,0,0,0,0,0,0,0,0,0,0,0,0,0,0,"kilograms",0,0,0,0,0,0,0,0,0,0,0,0,0,0,0,0,0,0.5,0,0,0,0,0,0,0,0,0,0,0,0,0,0,0,0,0,0,0,0,0,0,0,0,0,0,0,0,0,0,0,0,1.3,0,0,0,0,0,0,0,2.3,0,0,0,0,0,0,0,0,0,0,0,0,0,0,0,0,0,0,0,0,0,0,0,0,0,0,0,0,0,0,0,0,65,"celsius",75,19,"celsius",NA,NA,NA,NA,NA,NA,NA,NA,NA,NA,NA,NA,NA
