"58",4.2,"10/12/2012",3.39,56,71,"Hoppy Christmas","4.2% India Pale Ale ","hoppychristmas",156,"Hoppy Christmas","Simcoe Single-Hop India Pale Ale.","10/2012","Pineapple, citrus and papaya; single-hopped with Simcoe, Hoppy Christmas is an anti-festive IPA, redolent with summery flavours. Small caramel malt additions provide a touch of malt complexity. Simcoe, arguably our favourite hop, carries this beer - pine, tropical fruit and bitterness are its specialities.","https://images.punkapi.com/v2/156.png",7.2,70,1012,1067,30,15,4.4,82.1,20,"liters",25,"liters","Spiced cranberry turkey","Sriracha covered brussel sprouts","Ginger rice pudding","Get the freshest Simcoe for the best profile.","Sam Mason <samjbmason>",NA,NA,0,0,0,0,0,0,0,0,0,0,0,0,0,0,0,0,0,0,0,0,0,0,0,0,0,0,0,0,0,0,0,0,0,0,0,0,0,0,0,0,0,0,0,0,0,0,0,0,0,0,0,0,0,0,0,0,0,0,0,0,0,0,0,0,0,0,0,0,0,0,0,0,0,0,0,0,0,0,0,0,0,0,0,0,0,0,0,0,0,0,0,0,0,0,0,0,0,0,0,0,0,0,0,0,0,0,0,0,0,0,0,0,0,0,0,0,0,0,0,0,0,0,0,0,0,0,0,0,0,0,0,0,0,0,0,0,0,0,0,0,0,0,0,0,0,0,0,0,0,0,0,0,0,0,0,0,0,0,0,0,0,0,0,0,0,0,0,0,0,0,0,0,0,0,0,0,0,0,0,0,0,0,0,0,0,0,0,0,0,0,0,0,0,0,0,0,0,0,0,0,0,0,0,187.5,0,0,2.5,0,37.5,25,0,0,0,0,0,0,0,0,0,0,0,0,0,0,0,0,0,0,0,0,0,0,0,0,0,0,"kilograms",0,0,0,0,0,0,0,0,0,0,0,0,0,0,0,0,0,0.25,0,0,0,0,0,0,0,0,0,0,0.06,0,0,0,0,0,0,5.65,0,0,0,0,0,0,0,0,0,0,0,0,0,0,0,0,0,0,0,0,0,0,0,0,0,0,0,0,0,0,0,0,0,0,0,0,0,0,0,0,0,0,0,0,0,0,0,0,0,0,0,0,0,0,0,65,"celsius",NA,19,"celsius",NA,NA,NA,NA,NA,NA,NA,NA,NA,NA,NA,NA,NA
"59",5.5,"5/17/2007",3.2,97,77,"HopRocker","5.5% Premium Lager","hoprocker",117,"Hop Rocker","Hoppy Aggressive Lager","04/2007","The first of our foray into lager beer, Hop Rocker is a high impact, hoppy behemoth made with 100% malt. Since 2007 we have been obsessive about quality, using only the best ingredients to ensure the flavour and craftsmanship of the beer in your glass. Hop Rocker is testament to that. The malt base gives this beer a sweet, balanced complexity while the combination of New Zealand and German hops merges new world tropical juiciness with old world peppery spice.","https://images.punkapi.com/v2/117.png",5.5,40,1010,1052,25,12,4.2,80.7,20,"liters",25,"liters","Cajun spiced chicken wings","Mild cheddar","Lemon tart","After the fermentation has finished, chill the beer to below 5°C (if you can), wait 10 days and then rack the beer off the yeast into another bucket. The yeast left in suspension will carry on working its magic to create really clean, crisp lager flavours.","Sam Mason <samjbmason>",NA,NA,0,0,0,0,0,0,0,0,0,0,0,0,0,0,0,0,0,0,0,0,0,0,0,0,0,0,0,0,0,12.5,25,0,0,0,0,0,0,0,0,0,0,0,0,0,0,0,0,25,0,0,0,0,0,0,0,0,0,0,0,0,0,0,0,0,0,0,0,0,0,0,0,0,0,0,0,0,0,0,0,0,0,0,0,0,0,0,0,0,0,0,0,0,0,0,0,0,0,0,0,0,0,0,0,0,0,0,0,0,0,0,0,0,0,0,0,0,0,0,0,0,0,0,0,0,0,0,0,0,0,0,0,0,0,0,0,0,0,0,0,0,0,0,0,0,0,0,0,0,0,0,0,0,0,0,0,0,0,0,0,0,0,0,0,0,0,0,0,0,0,0,0,0,12.5,0,0,0,0,0,0,0,0,0,0,0,0,0,0,0,0,0,0,0,0,0,0,0,0,0,0,0,12.5,0,0,0,0,0,0,0,0,0,0,0,0,0,0,0,0,0,0,0,0,0,0,0,0,0,0,0,0,0,0,0,0,0,0,0,"kilograms",0,0,0,0,0,0,0,0,0,0,0,0,0,0,0,0,0,0.31,0,0,0,0,0,0,0,0,0,0,0,0,0,0,0,0,0,0,0,0,0,0,3.78,0,0,0,0,0,0,0,0,0,0,0,0.31,0,0,0,0,0,0,0,0,0,0,0,0,0,0,0,0,0,0,0,0,0,0,0,0,0,0,0,0,0,0,0,0,0,0,0,0,0,0,65,"celsius",75,10,"celsius",NA,NA,NA,NA,NA,NA,NA,NA,NA,NA,NA,NA,NA
"60",7.8,"9/16/2011",3.63,83,207,"Hops Kill Nazis","7.8% American Strong Ale","hopskillnazis",79,"Hops Kill Nazis","Imperial Red Ale.","08/2011","5AM Saint's big brother. Dry- hopping with Chinook gave Hops Kill Nazis a full-on, instantly recognisable US hop character - huge resinous aromas (think giant redwood) with a bitter grapefruit edge. The caramel malts bring flavours of toffee and burnt sugar, which gave Hops Kill Nazis a big, complex malt base supporting the intense hopping.","https://images.punkapi.com/v2/79.png",7.6,70,1015,1073,59,29.5,4.4,79.5,20,"liters",25,"liters","Candied almond and blue cheese rocket salad","Chicken Tikka Madras","Pecan pie","A red colour is a difficult hue to achieve in beer. Experiment with different amounts of Crystal malt to fine tune the colour.","Sam Mason <samjbmason>",NA,NA,0,0,0,0,0,0,0,0,0,0,0,0,0,0,0,0,0,0,0,0,0,0,0,0,0,0,0,0,0,0,0,0,0,0,0,0,62.5,0,0,0,0,0,0,178,0,0,40,62.5,0,0,0,0,0,0,0,0,0,0,0,0,0,0,0,0,0,0,0,0,0,0,0,0,0,0,0,0,0,0,0,0,0,0,0,0,0,0,0,0,0,0,0,0,0,0,0,0,0,0,0,0,0,0,0,0,0,0,0,0,0,0,0,0,0,0,0,0,0,0,0,0,0,0,0,0,0,0,0,0,0,0,0,0,0,0,0,0,0,0,0,0,0,0,0,0,0,0,0,0,0,0,0,0,0,0,0,0,0,0,0,0,0,0,0,0,0,0,0,0,0,0,0,0,0,0,0,0,0,0,0,0,0,0,0,0,0,0,0,0,0,0,0,0,0,0,0,0,0,0,0,0,0,0,0,0,0,0,0,0,0,0,0,0,0,0,0,0,0,0,0,0,0,0,0,0,0,0,0,0,0,0,0,0,0,0,0,0,"kilograms",0,0,0,0,0,0,0,0,0,0,0,0,0,0,0,0,0,2.5,0,0,0,0,0,0,0,0.96,0,0,0,0,0,0,0,0,0,0,0,0,0,0,0,0,0,0,0,0,0,0,0,0,0,4.82,0,0,0,0,0,0,0,0,0,0,0,0,0,0,0,0,0,0,0,0,0,0,0,0,0,0,0,0,0,0,0,0,0,0,0,0,0,0,0,68,"celsius",NA,20,"celsius",NA,NA,NA,NA,NA,NA,NA,NA,NA,NA,NA,NA,NA
"61",3.5,"5/8/2009",3.53,99,89,"How To Disappear Completely","3.5% Mild Ale","howtodisappearcompletely",179,"How To Disappear Completely","Fake Fix Double IPA.","04/2009","Jam-packed with two of our favourite hops - Columbus and Centennial, it has 198 (yes one hundred and ninety eight) theoretical IBUs. We use a lot of caramalt, some amber malt and some chocolate malt to give the little beer as much body and mouthfeel as possible and the ability to handle all the hops we threw at it. We think this beer is the world’s first ever Imperial Mild. Imperial in terms of hop profile. An Imperially Hopped Mild. BrewDog’s Imperial Mild. How to Disappear Completely.","https://images.punkapi.com/v2/179.png",3.5,198,1010,1037,37,19,4.4,73,20,"liters",25,"liters","Spicy pork sausages with red potato mash","Turnip beef stew with crusty fresh baked bread","Summer berry cheesecake","Dry Hopping: Columbus 37.5g, Centennial 37.5g, Galena 37.5g, Horizon 37.5g","Sam Mason <samjbmason>",NA,NA,0,0,0,0,0,0,0,0,0,0,0,0,0,0,0,0,0,0,0,0,0,0,0,0,0,0,0,0,0,0,0,0,0,0,0,25,18.8,25,0,0,0,0,0,0,0,0,0,0,0,0,0,0,0,0,0,0,0,0,0,0,0,0,0,0,0,0,0,0,0,50,18.8,25,0,0,0,0,0,0,0,0,0,0,0,0,0,0,0,0,0,0,0,0,0,0,0,0,0,0,0,0,0,0,0,0,0,0,0,0,0,0,0,0,0,0,0,0,0,18.8,0,0,0,0,0,0,0,0,0,0,0,0,0,0,0,0,0,0,0,0,0,0,0,0,0,0,0,0,0,0,0,0,0,0,0,0,0,0,0,0,0,0,0,0,0,0,0,0,0,0,0,0,0,0,0,0,0,0,0,0,0,0,0,0,0,0,0,0,0,0,0,0,0,0,0,0,0,0,0,0,0,0,0,0,0,0,0,0,0,0,18.8,0,0,0,0,0,0,0,0,0,0,0,0,0,0,0,0,0,0,0,0,0,0,0,0,0,0,0,"kilograms",0,0,0.081,0,0,0,0,0,0,0,0,0,0,0,0,0,0,0.63,0,0,0,0.081,0,0,0,0,0,0,0,0.081,0,0,0,0,0,2,0,0,0,0,0,0,0,0,0,0,0,0,0,0,0,0,0.31,0,0,0,0,0,0,0,0,0,0,0.31,0,0,0,0,0,0,0,0,0,0,0,0,0,0,0,0,0,0,0,0,0,0,0,0,0.31,0,0,65,"celsius",75,19,"celsius",NA,NA,NA,NA,NA,NA,NA,NA,NA,NA,NA,NA,NA
"62",5.4,"6/30/2012",3.31,73,17,"Hunter Foundation Pale Ale","5.4% American Pale Ale","hunterfoundationpaleale",67,"Hunter Foundation Pale Ale","American Pale Ale.","05/2012","This straight-up US style pale ale uses some of our favourite hops against a toasty malt base. We brewed this with Sir Tom Hunter at our Fraserburgh brewery - to add a charitable element to your own version, feel free to share this citrusy pale ale with your friends. Or don't, it's your choice.","https://images.punkapi.com/v2/67.png",5.4,35,1008,1050,11.5,5.75,4.4,84,20,"liters",25,"liters","Monterey Jack stuffed grilled jalepenos","Barbecue corn and steak fajita seasoned wrap","Cinnamon & white chocolate churro","To dry the beer out, mash at a slightly lower temp (62° - 63°C), this will increase the ratio of fermentable sugars in the beer.","Sam Mason <samjbmason>",NA,NA,0,0,0,0,0,0,10,0,25,0,0,0,0,0,0,0,0,0,0,0,0,0,0,0,0,0,0,0,0,0,0,0,0,0,0,0,0,0,0,0,0,0,0,0,0,0,0,0,0,0,0,0,0,0,20,0,0,0,0,0,0,0,0,0,0,0,0,0,0,0,0,0,0,0,0,0,0,0,0,0,0,0,0,0,0,0,0,0,0,0,0,0,0,0,0,0,0,0,0,0,0,0,0,0,0,0,0,0,0,0,0,0,0,0,0,0,0,0,0,0,0,0,0,0,0,0,0,0,0,0,0,0,0,0,0,0,0,0,0,0,0,0,0,0,0,0,0,0,0,0,0,0,0,0,0,0,0,0,0,0,0,0,0,0,0,0,0,0,0,0,0,0,0,0,0,0,0,0,0,0,0,0,0,0,0,0,0,0,0,0,0,0,0,0,0,0,0,0,0,0,0,0,0,0,0,0,15,0,0,0,0,0,0,0,0,0,0,0,0,0,0,0,0,0,0,0,0,0,0,0,0,0,0,0,0,0,"kilograms",0,0,0,0,0,0,0,0,0,0,0,0,0,0,0,0,0,0,0,0,0,0,0,0,0,0,0,0,0,0,0,0,0,0,0,0,0,0,0,0,0,0,0,0,0,0,0,0,0,0,0,4.3,0.8,0,0,0,0,0,0,0,0,0,0,0,0,0,0,0,0,0,0,0,0,0,0,0,0,0,0,0,0,0,0,0,0,0,0,0,0,0,0,63,"celsius",75,19,"celsius",NA,NA,NA,NA,NA,NA,NA,NA,NA,NA,NA,NA,NA
"63",6.5,"12/12/2013",3.57,98,102,"Interstellar","6.5% Specialty Grain","interstellar",191,"Interstellar","2013 Prototype Red Rye IPA.","11/2013","Interstellar is a Red Rye IPA with spicy rye flavours from the malt and with great all-round spicy, fruity and earthy hop aromas from the use of Willamette and Amarillo.","https://images.punkapi.com/v2/191.png",6.5,55,1011,1059,50,25,4.4,81.4,20,"liters",25,"liters","Oak chip smoked salmon","Sticky spicy barbecue ribs","Scottish tablet","Be careful with the rye malt in the run off. It can lead to stuck mashes and extended collection periods.","Ali Skinner <AliSkinner>",NA,NA,0,0,0,0,125,0,0,0,25,12.5,0,0,0,0,0,0,0,0,0,0,0,0,0,0,0,0,0,0,0,0,0,0,0,0,0,0,0,0,0,0,0,0,0,0,0,0,0,0,0,0,0,0,0,0,0,0,0,0,0,0,0,0,0,0,0,0,0,0,0,0,0,0,0,0,0,0,0,0,0,0,0,0,0,0,0,0,0,0,0,0,0,0,0,0,0,0,0,0,0,0,0,0,0,0,0,0,0,0,0,0,0,0,0,0,0,0,0,0,0,0,0,0,0,0,0,0,0,0,0,0,0,0,0,0,0,0,0,0,0,0,0,0,0,0,0,0,0,0,0,0,0,0,0,0,0,0,0,0,0,0,25,0,0,0,0,0,0,0,0,0,0,0,0,0,0,0,0,0,0,0,0,0,0,0,0,0,0,0,0,0,0,0,0,0,0,0,0,0,0,0,0,0,0,0,0,0,0,0,0,0,0,0,0,0,0,0,0,0,0,0,0,0,0,0,0,0,0,0,0,0,125,0,0,0,25,12.5,"kilograms",0.13,0,0,0,0,0,0,0,0,0,0,0,0,0,0,0,0,0,0,0,0,0,0,0,0,0.56,0,0,0.19,0,0,0,0,0,0,3.81,0,0,0,0,0,0,0,0,0,0,0,0,0,0,0,0,0,0,0,0,0,0,0,0,0,0,0,0,0,0,0,0,0,0,0,0,0,0,0,0,0.5,0,0,0,0,0,0,0,0,0,0,0,0,0,0,65,"celsius",75,19,"celsius",NA,NA,NA,NA,NA,NA,NA,NA,NA,NA,NA,NA,NA
"64",7.2,"7/6/2012",3.75,98,1085,"Jack Hammer","7.2% India Pale Ale ","jackhammer",168,"Jack Hammer","Ruthless India Pale Ale. Hoppy. Bitter. Hoppy.","06/2012","Hopped beyond the point at which IBUs are measurable, only the most hardened palate will get beyond Jack Hammer's intensely resinous pithy bitterness and to the grapefruit, orange zest and dry biscuity malt beyond. You could brew this with less hops, but really, why would you bother?","https://images.punkapi.com/v2/168.png",7.2,250,1010,1065,15,7.5,4.4,84.6,20,"liters",25,"liters","Phall Curry","Pork burrito with a habanero and mango chilli salsa","Ginger and grapefruit poundcake","Be aware that this is probably the hoppiest beer you will ever make. Make sure you use fresh hops, for a massive fresh grapefruit hit. Have everything else in your store cupboard, and buy your hops last, as close to brew day as possible!","Sam Mason <samjbmason>",NA,NA,0,0,0,0,100,0,0,0,0,0,0,0,0,0,0,0,0,0,0,0,0,0,0,0,0,0,0,0,0,0,0,0,0,0,0,25,50,18.75,0,0,0,0,0,0,0,0,0,0,0,100,0,0,0,0,0,0,0,0,0,0,0,0,0,0,0,0,30,0,0,0,25,18.75,0,0,0,0,0,0,0,0,0,0,0,0,0,0,0,0,0,0,0,0,0,0,0,0,0,0,0,0,0,0,0,0,0,0,0,0,0,0,0,0,0,0,0,0,0,0,0,0,0,0,0,0,0,0,0,0,0,0,0,0,0,0,0,0,0,0,0,0,0,0,0,0,0,0,0,0,0,0,0,0,0,0,0,0,0,0,0,0,0,0,0,0,0,0,0,0,0,0,0,0,0,0,0,0,0,0,0,0,0,0,0,0,0,0,0,0,0,0,0,0,0,0,0,0,0,0,0,0,0,0,0,100,0,0,0,0,0,0,0,0,0,0,0,0,0,0,0,0,0,0,0,0,0,0,0,0,0,0,0,0,0,0,0,0,"kilograms",0,0,0,0,0,0,0,0,0,0,0,0,0,0,0,0,0,0,0,0,0,0,0,0,0,0,0,0,0,0,0,0,0,0,0,5.8,0,0,0,0,0,0,0,0,0,0,0,0,0,0,0,0,0,0,0,0,0,0,0,0,0,0,0,0,0,0,0,0,0,0,0,0,0,0,0,0,0,0,0,0,0,0,0,0,0,0,0,0,0,0,0,65,"celsius",75,21,"celsius",NA,NA,NA,NA,NA,NA,NA,NA,NA,NA,NA,NA,NA
"65",6,"4/23/2014",3.34,57,13,"Jasmine IPA","6% India Pale Ale ","jasmineipa",186,"Jasmine IPA","Floral & Fruity India Pale Ale.","03/2014","This has big floral aromas backed up with some of our favourite fruity hop flavours. Bitter, bright and refreshing, our Jasmine IPA is a perfect spring beer for drinking outside (under a patio heater, with a pair of gloves on).","https://images.punkapi.com/v2/keg.png",5.8,40,1014,1060,35,17.5,4.4,76.7,20,"liters",25,"liters","Chicken satay","Thai fishcakes","Honey and almond sponge cake","When dry hopping with the jasmine, use a muslin or cloth like a tea bag, and make sure it has a heavy object in it (ensure its clean). This will help to keep the jasmine submerged in the beer for better flavour extraction.","Sam Mason <samjbmason>",NA,NA,0,0,0,0,125,0,0,0,25,0,0,0,0,0,0,0,0,0,0,0,0,0,0,0,0,0,0,0,0,0,0,0,0,0,0,0,0,0,0,0,0,0,0,0,0,0,0,0,0,0,0,0,0,0,0,0,0,0,0,0,0,0,0,0,0,0,0,0,0,0,0,0,0,0,0,0,0,0,0,0,0,0,0,0,0,0,0,0,0,0,0,0,0,0,0,0,0,0,0,0,0,0,0,0,0,0,0,0,0,0,0,0,0,0,0,0,0,0,0,0,0,0,0,0,0,0,0,0,0,0,0,0,0,0,0,0,0,0,0,0,0,0,0,0,0,0,0,0,0,37.5,31,0,0,0,0,0,0,0,0,0,0,0,0,0,0,0,0,0,0,0,125,50,12.5,0,0,0,0,0,0,0,0,0,0,0,0,0,0,0,0,0,0,0,0,0,0,0,0,0,0,0,0,0,0,0,0,0,0,0,0,0,0,0,0,0,0,0,0,0,0,0,0,0,0,0,0,0,0,0,0,0,0,0,0,0,0,0,"kilograms",0,0,0,0,0,0,0,0,0,0,0,0,0,0,0,0,0,0,0,0,0,0,0,0,0,0,0,0,0,0,0,0,0,0,0,0,0,0,0,0,0,0,0,0,0,0,0,0,0,0,0,0,0.63,0,0,0,0,0,0,0,4.69,0,0,0,0,0,0,0,0,0,0,0,0,0,0,0,0.31,0,0,0,0,0,0,0,0,0,0,0.63,0,0,0,65,"celsius",75,19,"celsius","Jasmine addition in cold conditioning",NA,NA,NA,NA,NA,NA,NA,NA,NA,NA,NA,NA
"66",4.7,"2/13/2016",3.67,96,450,"Jet Black Heart","4.7% Sweet Stout","jetblackheart",126,"Jet Black Heart","Oatmeal Milk Stout. Dark. Roasty. Velvety.","01/2016","Good things come to those who wait. This smooth and roasty oatmeal milk stout won our 2015 Prototype Challenge at a canter. Roasty coffee and chocolate lead to a decadent, full-bodied richness of near uncharted depths with a velvet mouthfeel from the addition of oatmeal and a touch of wheat. This is complemented at every turn by the Magnum and Sorachi Ace hops, with the latter bringing an intensity of smooth vanilla and dark berry fruit on the long, rewarding finish.","https://images.punkapi.com/v2/126.png",4.7,45,1019,1055,200,100,4.4,70,20,"liters",25,"liters","Oyster beignets","Beef shin stew","A Shakin' jesse","There's a lot of speciality malt in the mash. Make sure you take the run off nice and steady – increase the flow too much and pull in the bed at your peril.","Sasha <SashaMasondeCaires>",NA,NA,0,0,0,0,0,0,0,0,0,0,0,0,0,0,0,0,0,0,0,0,0,0,0,0,0,0,0,0,0,0,0,0,0,0,0,0,0,0,0,0,0,0,0,0,0,0,0,0,0,0,0,0,0,0,0,0,0,0,0,0,0,0,0,0,0,0,0,0,0,0,0,0,0,0,0,0,0,0,0,0,0,0,0,0,0,0,0,0,0,0,0,0,0,0,0,0,0,0,0,0,0,0,0,0,0,0,0,0,0,0,0,0,0,0,0,0,0,0,0,0,0,0,0,0,0,0,0,0,0,0,0,0,0,0,0,0,0,0,0,0,0,0,0,0,0,0,0,0,0,0,0,0,0,0,0,0,0,0,0,0,12.5,0,0,0,0,0,0,0,0,0,0,0,0,0,0,0,0,0,0,0,0,0,0,0,0,0,0,0,0,0,0,0,0,0,0,0,0,0,0,0,0,0,0,0,0,0,0,0,0,0,0,0,0,6.3,0,0,0,0,0,0,0,0,0,0,0,0,0,0,0,0,0,0,0,0,0,0,"kilograms",0,0,0,0.19,0,0,0.38,0,0,0,0,0,0,0.19,0,0,0,0,0,0,0,0,0,0,0,0.25,0,0,0.19,0,0,0,0,0,0,0,0,0,0,0,0,0,0,0,0.38,0,0,0.38,0,0,0,0,0,0,0,0,0,0,2.75,0,0,0,0,0,0,0,0,0,0,0,0,0,0,0,0,0,0,0,0,0,0,0,0,0,0,0,0,0.25,0,0,0,65,"celsius",75,19,"celsius",NA,NA,NA,NA,NA,NA,NA,NA,NA,NA,NA,NA,NA
"67",8.2,"11/18/2014",3.6,70,175,"Konnichiwa Kitsune","8.2% Imperial IPA","konnichiwakitsune",174,"Konnichiwa Kitsune","Hello My Name Is Yuzu.","10/2014","Named in a slight deviation from our Hello My Name Is series, Konnichiwa Kitsune is a Japanese- inspired, yuzu-infused Imperial IPA, brewed with Amarillo, Cascade and Citra. These punchy new world hops bring orange, grapefruit and lime to back up the yuzu aroma and flavour. Big mandarin notes, balanced against a caramel malt biscuity base.","https://images.punkapi.com/v2/174.png",4.4,70,1012,1045,30,15,4.4,82.9,20,"liters",25,"liters","Fresh seared tuna and rocket salad","Lemon meringue pie","Baked chicken with yuzu reduction","Squeeze the fresh yuzu juice directly into the beer after primary fermentation is complete. Putting it in the hot wort may seem like better practice, but the juice will cook and some of the fresh citrus character will be lost.","Sam Mason <samjbmason>",NA,NA,0,0,0,0,137.5,0,12.5,0,18.5,6,0,0,0,0,0,0,0,0,0,0,0,0,0,0,0,0,0,0,87.5,12.5,12.5,12.5,0,0,0,0,0,0,0,0,0,0,0,0,0,0,0,0,0,100,0,0,6,12.5,0,6,0,0,0,0,0,0,0,0,0,0,0,0,0,0,0,0,0,0,0,0,0,0,0,0,0,0,0,0,0,0,0,0,0,0,0,0,0,0,0,0,0,0,0,0,0,0,0,0,0,0,0,0,0,0,0,0,0,0,0,0,0,0,0,0,0,0,0,0,0,0,0,0,0,0,0,0,0,0,0,0,0,0,0,0,0,0,0,0,0,0,0,0,0,0,0,0,0,0,0,0,0,0,0,0,0,0,0,0,0,0,0,0,0,0,0,0,0,0,0,0,0,0,0,0,0,0,0,0,0,0,0,0,0,0,0,0,0,0,0,0,0,0,0,0,0,0,0,0,0,0,0,0,0,0,0,0,0,0,0,0,0,0,0,0,0,0,0,0,0,0,0,0,0,0,0,0,0,0,0,0,"kilograms",0,0,0,0,0,0,0,0,0,0,0,0,0,0,0,0,0,0.86,0,0,0,0,0,0,0,0,0,0,0,0,0,0,0,0,0,6.13,0,0,0,0,0,0,0,0,0,0,0,0,0,0,0,0,0,0,0,0,0,0,0,0,0,0,0,0,0,0,0,0,0,0,0,0,0,0,0,0,0,0,0,0,0,0,0,0,0,0,0,0,0,0,0,65,"celsius",75,20,"celsius","Yuzu juice: 250g at FV",NA,NA,NA,NA,NA,NA,NA,NA,NA,NA,NA,NA
"68",7.2,"4/18/2012",3.79,98,1019,"Libertine Black Ale","7.2% Black IPA","libertineblackale",167,"Libertine Black Ale","The New Black. Roasty. Hoppy. Fruity.","03/2012","A dark hop bomb combining the malt-forward indulgences of a stout with the insatiable hopload of an IPA. Rich spiced blackcurrant and caramel up front, with a sharp bitter finish following behind, bringing grapefruit and resin with it. Dry, bitter and intense; this is an IPA first and foremost, given a dark malt makeover. Originally brewed as a Simcoe only single hop IPA, we've experimented with adding a little Cascade and Mosaic for extra depth.","https://images.punkapi.com/v2/167.png",7.2,50,1013,1068,150,76,4.4,78.6,20,"liters",25,"liters","Grilled king prawns with a chilli lime sauce","Blue cheese burger","Flourless chocolate ginger cake","The goal here is to make a black beer that tastes like an IPA. Don't overload the black or roasted malts to try and achieve the correct colour. Too much roasted malts will suppress far too much of that beautiful citrus and tropical flavour from the Simcoe. It may be hard to get hold of Carafa, but it will allow you to get a great colour, without all of the characteristic roasty astringent flavours.","Sam Mason <samjbmason>",NA,NA,0,0,0,0,0,0,0,0,0,0,0,0,0,0,0,0,0,0,0,0,0,0,0,0,0,0,0,0,37.5,0,0,0,0,0,0,0,0,0,0,0,0,0,0,0,0,0,0,0,0,0,0,0,0,0,0,0,0,0,0,0,0,0,0,0,0,0,0,0,0,0,0,0,0,0,0,0,0,0,0,0,0,0,0,0,0,0,0,0,0,0,0,0,0,0,0,0,0,0,0,0,0,0,0,0,0,0,0,0,0,0,0,0,0,0,0,0,0,0,0,0,0,0,0,0,0,0,0,0,0,0,0,0,0,0,0,0,0,0,0,0,0,0,0,0,0,0,0,0,0,0,0,0,0,0,0,0,0,0,0,0,0,0,0,0,0,0,37.5,0,0,0,0,0,0,0,0,0,0,0,0,0,0,0,0,0,0,0,0,0,0,0,0,0,0,0,0,0,0,0,0,0,0,0,0,175,0,18.75,18.75,0,37.5,0,0,0,0,0,0,0,0,0,0,0,0,0,0,0,0,0,0,0,0,0,0,0,0,0,0,0,"kilograms",0,0,0,0,0,0,0,0,0,0,0,0,0,0.13,0,0.19,0,0.25,0,0,0,0,0,0,0,0.19,0,0,0,0,0,0,0,0,0,5.3,0,0,0,0,0,0,0,0,0,0,0,0,0,0,0,0,0,0,0,0,0,0,0,0,0,0,0,0,0,0,0,0,0,0,0,0,0,0,0,0,0,0,0,0,0,0,0,0,0,0,0,0,0,0,0,65,"celsius",75,19,"celsius",NA,NA,NA,NA,NA,NA,NA,NA,NA,NA,NA,NA,NA
"69",6.1,"2/7/2012",3.55,94,39,"Libertine Porter","6.1% Porter","libertineporter",16,"Libertine Porter","Dry-Hopped Aggressive Porter.","01/2012","An avalanche of cross-continental hop varieties give this porter a complex spicy, resinous and citrusy aroma, with a huge malt bill providing a complex roasty counterpoint. Digging deeper into the flavour draws out cinder toffee, bitter chocolate and hints of woodsmoke.","https://images.punkapi.com/v2/16.png",6.1,45,1020,1067,219,109.5,4.4,70.1,20,"liters",25,"liters","Blue cheese beef burger","Glazed short ribs","Chocolate cake","Mash in at a higher temperature to leave more unfermentable sugars in the wort. This gives the beer a sweeter porter profile.","Sam Mason <samjbmason>",NA,NA,0,0,0,0,0,0,0,0,0,0,0,0,0,0,0,0,0,0,0,0,0,0,0,0,0,0,0,0,0,0,0,0,0,0,0,0,0,0,0,0,0,0,0,0,0,0,0,0,0,0,0,0,0,0,0,0,0,0,0,0,0,0,0,0,0,0,0,75,25,31.25,0,0,0,0,0,0,0,0,0,0,0,0,0,0,0,0,0,0,0,0,0,0,0,0,0,0,0,0,0,0,0,0,0,0,0,0,0,0,0,0,0,0,0,0,0,75,0,25,0,0,0,0,0,0,0,0,0,0,0,0,0,0,0,0,0,0,0,0,0,0,0,0,0,0,0,0,0,0,0,0,0,0,0,0,0,0,0,0,0,0,0,0,0,0,0,0,0,0,0,0,0,0,0,0,0,0,0,0,0,0,0,0,0,0,0,0,0,0,0,0,0,0,0,0,0,0,0,0,0,0,0,0,0,100,0,0,0,0,0,0,0,0,0,0,0,0,0,0,0,0,0,0,0,0,0,0,0,0,0,0,0,0,0,0,25,0,"kilograms",0,0,0,0,0,0,0,0,0,0,0,0,0,0,0,0,0,1.25,0,0,0,0.63,0,0,0,0.63,0,0,0,0,0,0,0,0,0,0,0,5,0,0,0,0,0,0,0.31,0,0,0,0,0,0,0,0,0,0,0,0,0,0,0,0,0,0,0,0,0,0,0,0,0,0,0,0,0,0.63,0,0,0,0,0.06,0,0,0,0,0,0,0,0.31,0,0,0,68,"celsius",35,18,"celsius",NA,NA,NA,NA,NA,NA,NA,NA,NA,NA,NA,NA,NA
"70",5.2,"2/14/2013",3.48,90,50,"Lichtenstein Pale Ale","5.2% American Pale Ale","lichtensteinpaleale",187,"Lichtenstein Pale Ale","Us-Hopped Rye Pale Ale.","01/2013","Dry-hopped with some of our hop heroes, bringing incredibly fruity aromas of zesty orange, pithy grapefruit, pungent pine and resin, backed up with spicy, toasty malt flavours of toffee, biscuit, rye bread and toast crust.","https://images.punkapi.com/v2/187.png",5.2,50,1010,1050,17,8.5,4.4,80,20,"liters",25,"liters","Spicy fish tacos","Bacon mac 'n' cheese","Pear crumble","Munich malt adds a biscuit sweetness, while the rye adds a spicy bready character.","Sam Mason <samjbmason>",NA,NA,0,0,0,0,25,0,0,0,7.5,7.5,0,0,0,0,0,0,0,0,0,0,0,0,0,0,0,0,0,0,25,0,7.5,7.5,0,25,0,12.5,0,0,0,0,0,0,0,0,0,0,0,0,0,0,0,0,0,0,0,0,0,0,0,0,0,0,0,0,0,0,0,0,0,0,0,0,0,0,0,0,0,0,0,0,0,0,0,0,0,0,0,0,0,0,0,0,0,0,0,0,0,0,0,0,0,0,0,0,0,0,0,0,0,0,0,0,0,0,0,0,0,0,0,0,0,0,0,0,0,0,0,0,0,0,0,0,0,0,0,0,0,0,0,0,0,0,0,0,0,0,0,0,0,0,0,0,0,0,0,0,0,0,0,0,0,0,0,0,0,0,0,0,0,0,0,0,0,0,0,0,0,0,0,0,0,0,0,0,0,0,0,0,0,0,0,0,0,0,0,0,0,0,0,0,0,0,0,25,0,0,0,0,6.25,6.25,0,0,0,0,0,0,0,0,0,0,0,0,0,0,0,0,0,0,0,0,0,0,0,0,0,0,"kilograms",0,0,0,0,0,0,0,0,0,0,0,0,0,0,0,0,0,0,0,0,0,0,0,0,0,0.13,0,0,0,0,0,0,0,0,0,3.38,0,0,0,0,0,0,0,0,0,0,0,0,0,0,0,0,0.38,0,0,0,0,0,0,0,0,0,0,0,0,0,0,0,0,0,0,0,0,0,0,0,0.25,0,0,0,0,0,0,0,0,0,0,0,0,0,0,65,"celsius",75,19,"celsius",NA,NA,NA,NA,NA,NA,NA,NA,NA,NA,NA,NA,NA
"71",7.5,"5/11/2013",3.31,47,54,"Misspent Youth","7.5% Scotch Ale","misspentyouth",11,"Misspent Youth","Milk & Honey Scotch Ale.","04/2013","The brainchild of our small batch brewer, George Woods. A dangerously drinkable milk sugar- infused Scotch Ale.","https://images.punkapi.com/v2/keg.png",7.3,30,1020,1079,120,60,4.4,74.7,20,"liters",25,"liters","Roasted garlic and chilli infused camembert cheese","Korean style chicken wings","Chocolate milk shake","Lots of malt in this one. Mash-in in stages, and spread the pale ale malt throughout the mash to provide stability. If the mash starts to sink, stop, wait a few minutes while mixing, then start again.","Sam Mason <samjbmason>",NA,NA,0,0,0,0,0,0,0,0,0,0,0,0,0,0,0,0,0,0,0,0,0,0,0,0,0,0,0,0,0,0,0,0,0,0,0,0,0,0,0,0,0,0,0,0,0,0,0,0,0,0,0,0,0,0,0,0,0,0,0,0,0,0,0,0,0,0,0,0,0,0,0,0,0,0,0,0,0,0,0,0,0,0,0,0,0,0,0,0,0,0,0,0,0,0,0,0,0,0,0,0,0,0,10,25,0,0,0,10,0,25,0,0,0,0,0,0,0,0,0,0,0,0,0,0,0,0,0,0,0,0,0,0,0,0,0,0,0,0,0,0,0,0,0,0,0,0,250,0,0,0,0,0,0,0,0,0,0,0,375,0,0,0,0,0,0,0,0,0,0,0,0,0,0,0,0,0,0,0,0,0,0,0,0,0,0,0,0,0,0,0,0,0,0,0,0,0,0,0,0,0,0,0,0,0,0,0,0,0,0,0,0,0,0,0,0,0,0,0,0,0,0,0,0,0,0,0,0,0,0,0,0,0,0,0,0,0,"kilograms",0,0,0.1,0,0,0,0.6,0,0,0,0,0,0,0,0,0,0,0.3,0,0,0,0.05,0,0,0,0.2,0,0,0.3,0,0,0,0,0,0,0,0,0,0,0,0,0,0,0,0.6,0,0,0,0,0,0,0,0.6,0,0,0,0,0,2.18,0,0,0,0,0,0,0,0,0,0,0,0,0,0,0,0,0,0,0,0,0,0,0,1.8,0,0,0,0,0,0,0,0,67,"celsius",75,19,"celsius","See honey and lactose additions",NA,NA,NA,NA,NA,NA,NA,NA,NA,NA,NA,NA
"72",14.5,"9/26/2013",3.87,98,196,"Mix Tape 8","14.5% American Strong Ale","mixtape8",15,"Mixtape 8","An Epic Fusion Of Old Belgian, American New Wave, And Scotch Whisky.","01/2012","This recipe is for the Belgian Tripel base. A blend of two huge oak aged beers – half a hopped up Belgian Tripel, and half a Triple India Pale Ale. Both aged in single grain whisky barrels for two years and blended, each beer brings its own character to the mix. The Belgian Tripel comes loaded with complex spicy, fruity esters, and punchy citrus hop character.","https://images.punkapi.com/v2/15.png",14.5,50,1014,1093,40,20,4.4,85,20,"liters",25,"liters","Coriander & chilli crab cakes","Goats cheese salad with walnuts, radish and blood orange","Pistachio cake","Brew twice as much Belgian Tripel as you were planning on ageing - it's awesome on its own too!","Sam Mason <samjbmason>",NA,NA,0,0,0,0,0,0,0,0,0,0,0,0,0,0,0,0,0,0,0,0,0,0,0,0,0,0,0,0,0,0,37.5,0,0,0,0,0,37.5,0,0,0,0,0,0,0,0,0,0,0,0,0,0,0,0,0,0,0,0,0,0,0,0,0,0,0,0,0,12.5,0,0,0,0,0,0,0,0,0,0,0,0,0,0,0,0,0,0,0,0,0,0,0,0,0,0,0,0,0,0,0,0,0,0,0,0,0,0,0,0,0,0,0,0,0,0,0,0,0,0,0,0,0,0,0,0,0,0,0,0,0,0,0,0,0,0,0,0,0,0,0,0,0,0,0,0,0,0,0,0,0,0,0,0,0,0,0,0,0,0,0,0,0,0,0,0,0,0,0,0,0,0,0,0,0,0,0,0,0,0,0,0,0,0,0,0,0,0,0,0,0,0,0,0,0,0,0,0,0,0,0,0,0,0,0,0,0,0,0,0,0,37.5,0,0,0,0,0,0,0,0,0,0,0,0,0,0,0,0,0,0,0,0,0,0,0,0,0,0,0,"kilograms",0,0,0,0,0,0,0,0,0.94,0,0,0,0,0,0,0,0,0,0,0,0,0,0,0.44,0,0,0,0,0,0,0,0,0,0,0,0,0,0,0,0,0,0,0,0,0,0,0,0,0,0,0,0,0,0,0,0,0,0,0,11.1,0,0,0,0,0,0,0,0,0,0,0,0,0,0,0,0,0,0,0,0,0,0,0,0,0,0,0,0,0,0,0,65,"celsius",40,21,"celsius","Barrel aged and blended with Anarchist Alchemist",NA,NA,NA,NA,NA,NA,NA,NA,NA,NA,NA,NA
