"26",9.5,"2/8/2017",3.54,54,29,"Born to Die","9.5% Imperial IPA","borntodie",139,"Born To Die","Terminally Hoppy India Pale Ale.","03/2015","Savagely bitter, exceptionally dry, this IPA is born to die on a predetermined day. It proudly displays its short-lived life span front and centre. There is no better time to drink this than the moment you get your paws on it. Awesome bitterness backed up by unrelenting aromas of resin, citrus, and juicy fruit. Born To Die is a eulogy to the hops that sacrificed themselves in its creation. An incredibly ambitious and satisfying small batch brew.","https://images.punkapi.com/v2/139.png",8.5,85,1007,1072,15,7.5,4.4,90.3,20,"liters",25,"liters","Caramelised onion and lightly seared steak","Pulled barbecue brisket","Salted caramel cheesecake","Fresh is best with this beer. Use fresh hops in the brew and during dry hop stages. Condition just long enough to let the powerful grassy aroma cut back - and drink.","Sam Mason <samjbmason>",NA,NA,0,0,0,0,62.5,0,0,0,25,12.5,0,0,0,0,0,0,0,0,0,0,0,0,0,0,0,0,0,25,0,0,0,0,0,0,0,0,0,0,0,0,0,0,0,0,0,0,0,0,0,62.5,0,0,0,0,25,0,0,0,0,0,0,0,0,0,0,0,0,0,0,0,0,0,0,0,0,0,0,0,0,0,0,0,0,0,0,0,0,0,0,0,0,0,0,0,0,0,0,0,0,0,0,0,0,0,0,0,0,0,0,0,0,0,0,0,0,0,0,0,0,0,0,0,0,0,0,0,0,0,0,0,0,0,0,0,0,0,0,0,0,0,0,0,0,0,0,0,0,0,0,0,0,0,0,0,0,0,0,0,0,0,0,0,0,0,0,0,62.5,0,25,0,0,0,0,0,0,0,0,0,0,0,0,0,0,0,0,0,0,0,0,0,0,0,0,0,0,0,0,0,0,0,0,0,0,62.5,0,0,0,0,25,12.5,0,0,0,0,0,0,0,0,0,0,0,0,0,0,0,0,0,0,0,0,0,0,0,0,0,0,"kilograms",0,0,0,0,0,0,0,0,0,0,0,0,0,0,0,0,0,0,0,0,0,0,0,0,0,0,0,0,0,0,0,0,0,0,0,0,0,0,0,0,0,0,0,0,0,0,0,0,0,0,0,1,0,0,0,0,0,0,5.5,0,0,0,0,0,0,0,0,0,0,0,0,0,0,0,0,0,0,0,0,0,0,0,0,0,0,0,0,0,0,0,0,65,"celsius",NA,18,"celsius",NA,NA,NA,NA,NA,NA,NA,NA,NA,NA,NA,NA,NA
"27",5.8,"2/20/2014",3.55,86,325,"Bourbon Baby","5.8% Scotch Ale","bourbonbaby",34,"Bourbon Baby","Barrel-Aged Scotch Ale.","01/2014","Santa Paws Scotch ale aged in bourbon barrels - light, dry and toasty, with vanilla, hints of chocolate and ginger biscuit, and a faint spicy hoppiness.","https://images.punkapi.com/v2/34.png",5.8,35,1005,1049,44,22,4.4,90,20,"liters",25,"liters","Blackened cajun beef","Pulled pork","Millionaire's shortbread","Use bourbon-soaked oak chips in secondary to achieve barrel character.","Ali Skinner <AliSkinner>",NA,NA,0,0,0,0,0,0,0,0,0,0,0,0,0,0,0,0,0,0,0,0,0,0,0,0,0,0,0,0,0,0,0,0,0,0,0,0,0,0,0,0,0,0,0,0,0,0,0,0,0,0,0,0,0,0,0,0,0,0,0,0,0,0,0,0,0,0,0,0,0,0,0,0,0,0,0,0,0,0,0,0,0,0,0,0,0,0,0,0,0,0,0,0,0,0,0,0,0,0,0,0,0,0,0,18.5,0,0,0,0,0,0,0,0,0,0,0,0,0,0,0,0,0,0,0,0,0,0,0,0,0,0,0,0,6,0,0,0,0,0,0,0,0,0,0,0,0,0,0,0,0,0,0,0,0,0,0,0,0,0,0,0,0,0,0,0,0,0,0,0,0,0,0,0,0,0,0,0,0,0,0,0,0,0,0,0,0,0,0,0,0,0,0,0,0,0,0,0,0,0,0,0,0,0,0,0,0,0,0,0,0,0,0,0,0,0,0,0,0,0,0,0,0,0,0,0,0,0,0,0,0,0,0,0,0,0,0,12.5,"kilograms",0,0,0.25,0,0,0,0,0,0,0,0,0,0,0,0,0.13,0,0,0,0,0,0,0,0,0,0,0,0,0.5,0,0,0,0,0,0,1.75,0,0,0,0,0,0,0,0,0.56,0,0,0,0,0,0,0,0.44,0,0,0,0,0,0,0,0,0,0,0,0,0,0,0,0,0,0,0,0,0,0,0,0,0,0,0,0,0,0,0,0,0.06,0,0.56,0,0,0,65,"celsius",90,19,"celsius",NA,NA,NA,NA,NA,NA,NA,NA,NA,NA,NA,NA,NA
"28",5,"12/12/2013",3.48,86,380,"Brixton Porter","5% Porter","brixtonporter",215,"Brixton Porter","Paradigm-Changing Porter.","11/2013","Brixton Porter delivers bold chocolate and coffee flavours with light smokiness and hints of autumn fruit all but built on a low ABV, lighter bodied backbone. Complex and intriguing, with spicy bitterness, but very sessionable.","https://images.punkapi.com/v2/215.png",5,50,1014,1053,200,100,4.4,73.6,20,"liters",25,"liters","Grilled rib-eye steak","Baked curry chickpea snacks","Chocolate and walnut brownie","After the primary fermentation has finished, leave the beer in contact with the yeast for around 48 hours. Any longer and there is a risk that it will start to impart yeasty, bready flavours to the beer.","Ali Skinner <AliSkinner>",NA,NA,0,0,0,0,0,0,0,0,0,0,0,0,0,0,0,0,0,0,0,0,0,12.5,0,0,12.5,0,0,0,0,0,0,0,0,0,0,0,0,0,0,0,0,0,12.5,0,0,0,0,0,0,0,0,0,0,0,0,0,0,0,0,0,0,0,0,0,0,0,0,0,0,0,0,0,0,0,0,0,0,0,0,0,0,0,0,0,0,0,0,0,0,0,0,0,0,0,0,0,0,0,0,0,0,0,0,0,0,0,0,0,0,0,0,0,0,0,0,0,0,0,0,0,0,0,0,0,0,0,0,0,0,0,0,0,0,0,0,0,0,0,0,0,0,0,0,0,0,0,0,0,0,0,0,0,0,0,0,0,0,0,0,0,0,0,0,0,0,0,0,0,0,0,0,0,0,0,0,0,0,0,0,0,0,0,0,0,0,0,0,0,0,0,0,0,0,0,0,0,0,0,0,0,0,0,0,0,0,0,0,0,0,0,0,0,0,0,0,0,0,0,0,0,0,0,0,0,0,0,0,0,0,0,0,0,0,0,0,0,"kilograms",0,0,0.31,0.13,0,0,0,0,0,0,0,0,0,0,0,0,0,0,0,0,0,0,0,0,0,0,0,0,0.19,0,0,0,0,0,0,3.8,0,0,0,0,0,0,0,0,0.25,0,0,0,0,0,0,0,0,0,0,0,0,0,0,0,0,0,0,0,0,0,0,0,0,0,0,0,0,0,0.31,0,0,0,0,0,0,0,0,0,0,0,0,0,0,0,0,65,"celsius",75,19,"celsius",NA,NA,NA,NA,NA,NA,NA,NA,NA,NA,NA,NA,NA
"29",4.5,"10/13/2007",3.2,90,11,"Buzz","4.5% Bitter","buzz",1,"Buzz","A Real Bitter Experience.","09/2007","A light, crisp and bitter IPA brewed with English and American hops. A small batch brewed only once.","https://images.punkapi.com/v2/keg.png",4.5,60,1010,1044,20,10,4.4,75,20,"liters",25,"liters","Spicy chicken tikka masala","Grilled chicken quesadilla","Caramel toffee cake","The earthy and floral aromas from the hops can be overpowering. Drop a little Cascade in at the end of the boil to lift the profile with a bit of citrus.","Sam Mason <samjbmason>",NA,NA,0,0,0,0,0,0,0,0,0,0,0,0,0,0,0,0,0,0,0,0,0,0,0,0,0,0,0,0,0,0,37.5,0,0,0,0,0,0,0,0,0,0,0,0,0,0,0,0,0,0,0,0,0,0,0,0,0,0,0,0,0,0,0,0,0,0,0,0,0,0,0,0,0,0,0,0,0,0,0,0,0,0,0,0,0,0,0,0,0,0,0,0,0,0,0,0,0,0,0,0,0,0,0,0,25,0,37.5,0,0,0,25,0,37.5,0,0,0,0,0,0,0,0,0,0,0,0,0,0,0,0,0,0,0,0,0,0,0,0,0,0,0,0,0,0,0,0,0,0,0,0,0,0,0,0,0,0,0,0,0,0,0,0,0,0,0,0,0,0,0,0,0,0,0,0,0,0,0,0,0,0,0,0,0,0,0,0,0,0,0,0,0,0,0,0,0,0,0,0,0,0,0,0,0,0,0,0,0,0,0,0,0,0,0,0,0,0,0,0,0,0,0,0,0,0,0,0,0,0,0,0,0,0,0,0,0,0,0,0,"kilograms",0,0,0,0,0,0,0,0,0,0,0,0,0,0,0,0,0,0.2,0,0,0,0,0,0,0,0,0,0,0,0,0,0,0,0,0,0,0,0,0,0,0,0,0,0,0,0,0,0,0,0,0,3.3,0.4,0,0,0,0,0,0,0,0,0,0,0,0,0,0,0,0,0,0,0,0,0,0,0,0,0,0,0,0,0,0,0,0,0,0,0,0,0,0,64,"celsius",75,19,"celsius",NA,NA,NA,NA,NA,NA,NA,NA,NA,NA,NA,NA,NA
"30",5.2,"9/18/2015",3.17,64,285,"Candy Kaiser","5.2% Altbier","candykaiser",123,"Candy Kaiser","NorDdeutsches Retro Altbier.","08/2015","In this northern German style retro altbier, we’ve dialled down the dry-hops to zero, but cranked up the malt to create massive aromas. Toasty, toffee and floral notes duke it out for supremacy in the headspace of your glass. When this all hits your palate, the steely bitterness combines with the rich dry malt and the subtle alcohol warmth in a full throttle attack on your taste buds.","https://images.punkapi.com/v2/123.png",5.2,45,1009,1049,45,22.5,4.2,81.6,20,"liters",25,"liters","Aged gouda","German bratwurst sausage","Poached pear fritters","Make sure that the boil is vigorous enough to roll. This means that high flavours are active, and undesirable compounds like DMS are not left in the beer.","Sam Mason <samjbmason>",NA,NA,0,0,0,0,0,0,0,0,0,0,0,0,0,0,0,0,0,0,0,0,0,0,0,0,0,0,0,0,0,0,0,0,0,0,0,0,0,0,0,0,0,0,0,0,0,0,0,0,0,0,0,0,0,0,0,0,0,0,0,0,0,0,0,0,0,0,0,0,0,0,0,0,0,0,0,0,0,0,0,0,0,0,0,0,0,0,0,0,0,0,0,0,0,0,0,0,0,0,0,0,0,0,0,0,0,0,0,0,0,0,0,0,0,0,0,0,0,0,0,0,0,0,0,0,0,0,0,0,0,0,0,0,0,0,0,0,0,0,0,0,0,0,0,0,25,0,0,0,0,0,0,0,0,0,0,0,0,0,0,0,25,0,0,0,0,0,0,0,0,0,0,0,0,0,0,0,0,0,0,0,0,0,0,0,0,0,0,0,0,0,0,0,0,0,0,0,0,0,0,0,0,0,0,0,0,0,0,0,0,0,0,0,0,0,0,0,0,0,0,0,0,0,0,0,0,0,0,0,0,0,0,0,0,0,0,0,"kilograms",0,0,0,0,0,0,0,0,0,0,0,0,0,0.13,0,0,0,0,0,0,0,0,0,0,0,0,0,0,0,0,0,0,0,0,0,0,0,0,0,0,0,0,0,0,0,0,0,0,0,0,0,0,0.44,0,0,0,0,0,3.94,0,0,0,0,0,0,0,0,0,0,0,0,0,0,0,0,0,0,0,0,0,0,0,0,0,0,0,0,0,0,0,0,65,"celsius",NA,14,"celsius",NA,NA,NA,NA,NA,NA,NA,NA,NA,NA,NA,NA,NA
"31",7.1,"11/19/2008",3.51,80,385,"Chaos Theory","7.1% India Pale Ale ","chaostheory",124,"Chaos Theory","Predictably Random IPA.","10/2008","Chaos Theory is the most under- rated achievement of 20th Century science. This beer can only aspire to parallel to the mathematical use of the word chaos, which is at odds to the common parlance. The purest showcase of the magnificent hop that is Nelson Sauvin; grapefruit, pineapple and caramel sing above the chaos of life.","https://images.punkapi.com/v2/124.png",7.1,90,1013,1067,15,7.5,4.4,80.6,20,"liters",25,"liters","Spicy mexican meatball stew","Habenero and mango pulled pork tacos","Spiced pumpkin pie with chocolate whipped cream","Get to know the guys in your local homebrew shop. They can give you a heads up when rare brewing materials – like Nelson Sauvin – are coming in.","Sam Mason <samjbmason>",NA,NA,0,0,0,0,0,0,0,0,0,0,0,0,0,0,0,0,0,0,0,0,0,0,0,0,0,0,0,0,0,0,0,0,0,0,0,0,0,0,0,0,0,0,0,0,0,0,0,0,0,0,0,0,0,0,0,0,0,0,0,0,0,0,0,0,0,0,0,0,0,0,0,0,0,0,0,0,0,0,0,0,0,0,0,0,0,0,0,0,0,0,0,0,0,0,0,0,0,0,0,0,0,0,0,0,0,0,0,0,0,0,0,0,0,0,0,0,0,0,0,0,0,0,0,0,0,0,0,0,0,0,0,0,0,0,0,0,0,0,0,0,0,0,0,0,0,0,0,0,0,0,0,0,0,0,0,0,0,0,0,0,0,0,0,0,0,0,0,0,0,0,0,0,0,0,0,0,0,0,12.5,50,12.5,0,0,0,0,0,0,0,0,0,0,0,0,0,0,0,0,0,0,0,0,0,0,0,0,0,0,0,0,0,0,0,0,0,0,0,0,0,0,0,0,0,0,0,0,0,0,0,0,0,0,0,0,0,0,0,"kilograms",0,0,0,0,0,0,0,0,0,0,0,0,0,0,0,0,0,0.63,0,0,0,0,0,0,0,0.25,0,0,0,0,0,0,0,0,0,0,0,0,0,0,0,0,0,0,0,0,0,0,0,0,0,0,0,0,0,0,0,0,5,0,0,0,0,0,0,0,0,0,0,0,0,0,0,0,0,0,0,0,0,0,0,0,0,0,0,0,0,0,0,0,0,65,"celsius",75,19,"celsius",NA,NA,NA,NA,NA,NA,NA,NA,NA,NA,NA,NA,NA
"32",7.2,"9/15/2016",3.35,48,115,"Chili Hammer","7.2% India Pale Ale ","chilihammer",226,"Chili Hammer","Our Ruthless IPA With A Fiery Twist.","06/2016","Chili Hammer is the third of our super-charged hyped up hybrids. A smooth tongued spicy assassin. Chili and American hops unite for a flavour bigger than Texas. Citrus peel, mango, with a hint of spice on the nose. Delivers big grapefruit and mango with a smooth chili kick, followed by the bitterest of bitter finishes. Chili Hammer – turn up the gas.","https://images.punkapi.com/v2/226.png",7.2,250,1010,1065,15,7.5,4.4,84.6,20,"liters",25,"liters","Aubergine and chickpea tagine","Firehouse chili con carne","Vanilla milkshake","There are a multitude of chilies you can experiment with. Try the difference between Arbol and Habaneros.","Sam Mason <samjbmason>",NA,NA,0,0,0,0,100,0,0,0,0,0,0,0,0,0,0,0,0,0,0,0,0,0,0,0,0,0,0,0,0,0,0,0,0,0,0,25,50,18.75,0,0,0,0,0,0,0,0,0,0,0,100,0,0,0,0,0,0,0,0,0,0,0,0,0,0,0,0,30,0,0,0,25,18.75,0,0,0,0,0,0,0,0,0,0,0,0,0,0,0,0,0,0,0,0,0,0,0,0,0,0,0,0,0,0,0,0,0,0,0,0,0,0,0,0,0,0,0,0,0,0,0,0,0,0,0,0,0,0,0,0,0,0,0,0,0,0,0,0,0,0,0,0,0,0,0,0,0,0,0,0,0,0,0,0,0,0,0,0,0,0,0,0,0,0,0,0,0,0,0,0,0,0,0,0,0,0,0,0,0,0,0,0,0,0,0,0,0,0,0,0,0,0,0,0,0,0,0,0,0,0,0,0,0,0,0,100,0,0,0,0,0,0,0,0,0,0,0,0,0,0,0,0,0,0,0,0,0,0,0,0,0,0,0,0,0,0,0,0,"kilograms",0,0,0,0,0,0,0,0,0,0,0,0,0,0,0,0,0,0,0,0,0,0,0,0,0,0,0,0,0,0,0,0,0,0,0,5.8,0,0,0,0,0,0,0,0,0,0,0,0,0,0,0,0,0,0,0,0,0,0,0,0,0,0,0,0,0,0,0,0,0,0,0,0,0,0,0,0,0,0,0,0,0,0,0,0,0,0,0,0,0,0,0,65,"celsius",75,21,"celsius","2.5g chili powder in the boil, 1 whole chili in FV",NA,NA,NA,NA,NA,NA,NA,NA,NA,NA,NA,NA
"33",12,"1/16/2014",3.61,76,252,"Clown King","12% Barley Wine","clownking",103,"Clown King","US Style Barley Wine.","12/2013","A heavy hitting combination of rich malt flavours and relentless, bitter hops. Aromas of caramel and toasted marshmallow, with raisin and dried fruit, alongside a spicy undercurrent of resin. With toasty malt and sweet dark fruit flavours, and a smooth, chewy mouthfeel, you’ll be lulled into a false sense of security, before the intense pine-sap resin draws out a huge bitter finish.","https://images.punkapi.com/v2/103.png",12,85,1020,1130,24,12,4.4,102.3,20,"liters",25,"liters","Aged Stilton","Flaky pastry beef pie and sweet potato mash","Chocolate pecan praline cake","Leave this beer to chill in the cellar for a few months to round off the flavour profile.","Ali Skinner <AliSkinner>",NA,NA,62.5,0,18.5,18.5,0,0,0,0,0,0,0,0,0,0,0,0,0,0,0,0,0,0,0,0,0,0,0,0,0,0,0,0,0,0,0,0,0,0,0,0,0,0,0,0,0,0,0,0,0,0,0,0,0,0,0,0,0,0,0,0,0,0,0,0,0,0,0,0,0,0,0,0,0,0,0,0,0,0,0,0,0,0,0,0,0,0,0,0,0,0,0,0,0,0,0,0,0,0,0,0,0,0,0,0,0,0,0,0,0,0,0,0,0,0,0,0,0,0,0,0,0,0,0,0,0,0,0,0,0,0,0,0,0,0,0,0,0,0,0,0,0,0,0,0,0,0,0,0,0,0,0,0,0,0,0,0,0,0,0,0,25,0,0,0,0,0,62.5,0,12.5,12.5,0,0,0,0,0,0,0,0,0,0,0,0,0,0,0,0,0,0,0,0,0,0,0,0,0,0,0,0,0,0,0,0,0,62.5,0,0,0,0,0,18.5,0,0,0,0,0,0,0,0,0,0,0,0,0,0,0,0,0,0,0,0,0,0,0,0,0,0,"kilograms",0,0,0,0,0,0,0.25,0,0,0,0,0,0,0,0,0,0,0.5,0,0,0,0,0,0,0,0.13,0,0,0,0,0,0,0,0,0,9.5,0,0,0,0,0,0,0,0,0,0,0,0,0,0,0,0,0.88,0,0,0,0,0,0,0,0,0,0,0,0,0,0,0,0,0,0,0,0,0,0,0,0,0,0,0,0,0,0,0,0,0,0,0,0,0,0,65,"celsius",90,21,"celsius",NA,NA,NA,NA,NA,NA,NA,NA,NA,NA,NA,NA,NA
"34",10,"12/10/2012",3.93,93,881,"Cocoa Psycho","10% Imperial Stout","cocoapsycho",109,"Cocoa Psycho","Russian Imperial Stout. Rich. Decadent. Mocha.","11/2012","Vanilla pods and toasted oak chips add a rounded character to this massive Russian Imperial Stout, brewed with a hefty malt bill, cacao nibs and coffee beans. Dark malts combine with Cascade to add a punchy bitterness, strong enough to offset the big chocolate sweetness.","https://images.punkapi.com/v2/109.png",10,85,1012,1098,30,15.25,4.4,70,20,"liters",25,"liters","Smokey sweet pulled brisket","Espresso crusted venison with a dark cherry jus","Affogato with vanilla ice cream","Put coffee beans and cocoa nibs in a cheese cloth and dip in wort like a tea bag. Do multiple small additions for short lengths of time – the longer you leave them in the more heavy oils will be extracted.","Sam Mason <samjbmason>",NA,NA,0,0,0,0,0,0,0,0,0,0,0,0,0,0,0,0,0,0,0,0,0,0,0,0,0,0,0,0,0,75,0,25,0,0,0,0,0,0,0,0,0,0,0,0,0,0,0,0,0,0,0,0,0,0,0,0,0,0,0,0,0,0,0,0,0,0,0,0,0,0,0,0,0,0,0,0,0,0,0,0,0,0,0,0,0,0,0,0,0,0,0,0,0,0,0,0,0,0,0,0,0,0,0,0,0,0,0,0,0,0,0,0,0,0,0,0,0,0,0,0,0,0,0,0,0,0,0,0,0,0,0,0,0,0,0,0,0,0,0,0,0,0,0,0,0,0,0,0,0,0,0,0,0,0,0,0,0,0,0,0,0,0,0,0,0,0,0,0,0,0,0,0,0,0,0,0,0,0,0,0,0,0,0,0,0,0,0,0,0,0,0,0,0,0,0,0,0,0,0,0,0,0,0,0,0,0,0,0,0,0,0,0,0,0,0,0,0,0,0,0,0,0,0,0,0,0,0,0,0,0,0,0,0,0,0,0,"kilograms",0,0,0,1.25,0,0,0,0,0,0,0,0,0,0,0,0,0,0,0,0,0,0,0,0,0,0,0,0,0.13,0,0,0,0,0,0,6.88,0,0,0,0,0,0,0,0,0,0,0,0,0,0,0,0,0,0,0,0,0,0,0,0,0,0,0,0,0,0,0,0,0,0,0,0,0,0,1.5,0,0,0,0,0,0,0,0,0,0,0,0.5,1,0,0,0,65,"celsius",75,21,"celsius","Coffee Beans: 25g at end, Cocoa Nibs: 25g at end, Cocoa Nibs: 25g at conditioning, Coffee Beans: 25g at conditioning, Oak Chips: 15g at conditioning",NA,NA,NA,NA,NA,NA,NA,NA,NA,NA,NA,NA
"35",9,"12/14/2008",3.51,35,138,"Coffee Imperial Stout","9% Imperial Stout","coffeeimperialstout",58,"Coffee Imperial Stout","Beats a Cup of Joe.","11/2008","This beer was released as both as \Danish Beerhouse Coffee Imperial Stout\ and \BrewDog Coffee Imperial Stout\. Deep, dark, roasted flavours make this a perfect Sunday brunch beer.","https://images.punkapi.com/v2/58.png",9,65,1019,1080,97,49,4.4,76,20,"liters",25,"liters","Gooey chocolate brownies","Chicken fried steak with cheesy mash","Spicy chicken empanadas","Grind the coffee as if making an espresso to really get the most out of it.","Sam Mason <samjbmason>",NA,NA,0,0,0,0,0,0,0,0,0,0,0,0,0,0,0,0,0,0,0,0,0,0,0,0,0,0,0,0,0,0,0,0,0,0,0,0,0,0,0,0,0,0,0,0,0,0,25,0,0,0,0,0,0,0,0,0,0,0,0,0,9.4,9.4,0,0,0,0,0,0,0,0,0,0,0,0,0,0,0,0,0,0,0,0,0,0,0,0,0,0,0,0,0,0,0,0,0,0,0,0,0,0,0,0,0,0,25,0,0,0,0,0,0,0,0,0,0,0,25,25,0,0,0,0,0,0,0,0,0,0,0,0,0,0,0,0,0,0,0,0,0,0,0,0,0,0,0,0,0,0,0,0,0,0,0,0,0,0,0,0,0,0,0,0,0,0,0,0,0,0,0,0,0,0,0,0,0,0,0,0,0,0,0,0,0,0,0,0,0,0,0,0,0,0,0,0,0,0,0,0,0,0,0,0,0,0,0,0,0,0,0,0,0,0,0,0,0,0,0,0,0,0,0,0,0,0,0,0,0,0,0,0,0,0,0,0,0,0,"kilograms",0,0,0,0,0,0,0,0,0,0,0,0,0,0,0,0,0,0,0,0,0,0.31,0,0,0,0,0,0,0.63,0,0,0,0,0,0,7.5,0,0,0,0,0,0,0,0,0,0,0,0,0,0,0,0,0,0,0,0,0,0,0,0,0,0,0,0,0,0,0,0,0,0,0,0,0,0.31,0,0,0,0,0,0,0,0,0,0,0,0,0,0,0,0,0,64,"celsius",90,19,"celsius","Coffee added after boil. Aged on French oak chips., Dark muscovado sugar: 312.5g for 20mins",NA,NA,NA,NA,NA,NA,NA,NA,NA,NA,NA,NA
"36",5.4,"5/8/2008",3.06,86,62,"Cult Lager","5.4% Premium Lager","cultlager",214,"Cult Lager","US & New Zeland Hopped Lager","04/2008","A lager that actually tastes of something? You have to be kidding, right? Cult lager is made with 100% malt and whole leaf hops. Maybe we are crazy, so what? Taste our lager and we are pretty sure that you will agree that the fine line between insanity and genius has just become a little more blurred.","https://images.punkapi.com/v2/214.png",5.4,50,1049,1008,19,8,4.1,83.7,20,"liters",25,"liters","Arrabiata pasta with grilled prawns","Mexican spiced chicken with hot sauce","Orange marmalade thumb print cookie","When the fermentation is nearly complete, allow the temperature of the beer to rise. This will scrub some of the undesirable flavours out.","Sam Mason <samjbmason>",NA,NA,0,0,0,0,0,0,0,0,0,0,0,0,0,0,0,0,0,0,0,0,0,0,0,0,0,0,0,0,0,12.5,25,0,0,0,0,0,0,0,0,0,0,0,0,0,0,0,0,25,0,0,0,0,0,0,0,0,0,0,0,0,0,0,0,0,0,0,0,0,0,0,0,0,0,0,0,0,0,0,0,0,0,0,0,0,0,0,0,0,0,0,0,0,0,0,0,0,0,0,0,0,0,0,0,0,0,0,0,0,0,0,0,0,0,0,0,0,0,0,0,0,0,0,0,0,0,0,0,0,0,0,0,0,0,0,0,0,0,0,0,0,0,0,0,0,0,0,0,0,0,0,0,0,0,0,0,0,0,0,0,0,0,0,0,0,0,0,0,0,0,0,0,0,12.5,0,0,0,0,0,0,0,0,0,0,0,0,0,0,0,0,0,0,0,0,0,0,0,0,0,0,0,12.5,0,0,0,0,0,0,0,0,0,0,0,0,0,0,0,0,0,0,0,0,0,0,0,0,0,0,0,0,0,0,0,0,0,0,0,"kilograms",0,0,0,0,0,0,0,0,0,0,0,0,0,0,0,0,0,0,0,0,0,0,0,0,0,0,0,0,0,0,0,0,0,0,0,0,0,0,0,0,0,0,0,0,0,0,0,0,4.66,0,0,0,0,0,0,0,0,0,0,0,0,0,0,0,0,0,0,0,0,0,0,0,0,0,0,0,0,0,0,0,0,0,0,0,0,0,0,0,0,0,0,65,"celsius",75,10,"celsius",NA,NA,NA,NA,NA,NA,NA,NA,NA,NA,NA,NA,NA
"37",6.5,"10/7/2013",3.61,95,163,"Dead Metaphor","6.5% Stout","deadmetaphor",210,"Dead Metaphor","Scottish Breakfast Stout.","09/2013","Scottish chocolate breakfast Stout - brewed with Brazilian Serta~o coffee, Venezuelan cacao and (for the Scottish element) oatmeal. Smooth, chocolately and rich, with a honeycomb mouthfeel and a rich red berry coffee character. Brewed with our beer blogger friends from The Beer Cast and Hopzine.","https://images.punkapi.com/v2/210.png",6.8,30,1016,1068,86,43,4.4,76.5,20,"liters",25,"liters","Brisket burnt ends","Candied bacon French toast","Coco Pops (add stout to cereal)","Steep the cocoa nibs and chocolate in the hot wort for a short period for the best extraction of flavour compounds.","Ali Skinner <AliSkinner>",NA,NA,0,0,0,0,0,0,0,0,0,0,0,0,0,0,0,0,0,0,0,0,0,0,0,0,0,0,0,0,0,0,0,0,0,0,0,0,0,0,0,0,0,0,0,0,0,0,0,0,0,0,0,0,0,0,0,0,0,0,0,0,0,0,0,0,0,0,0,0,0,0,0,0,0,0,0,0,0,0,0,0,0,0,0,0,0,0,0,0,0,0,0,0,0,0,0,0,0,0,0,0,0,0,0,0,0,0,0,0,0,0,0,0,0,0,0,0,0,0,0,0,0,0,0,0,0,0,0,0,0,0,0,0,0,0,0,0,0,0,0,0,0,0,0,0,0,0,0,0,0,0,0,0,0,0,0,0,0,0,0,0,25,0,0,0,0,0,0,0,0,0,0,0,0,0,0,0,0,0,0,0,0,0,0,0,0,0,0,0,0,0,0,0,0,0,0,0,0,0,0,0,0,0,0,0,0,0,0,0,0,0,0,0,0,0,0,0,0,0,0,0,0,0,0,0,0,0,0,0,0,0,0,0,0,0,0,0,"kilograms",0,0,0,0.31,0,0,0.31,0,0,0,0,0,0,0.19,0,0,0,0,0,0,0,0,0,0,0,0.31,0,0,0.19,0,0,0,0,0,0,4.38,0,0,0,0,0,0,0,0,0.44,0,0,0,0,0,0,0,0,0,0,0,0,0,0,0,0,0,0,0,0,0,0,0,0,0,0,0,0,0,0,0,0,0,0,0,0,0,0,0,0,0,0,0.31,0,0,0,64,"celsius",75,19,"celsius","Cacao: 37.5g at end, Lactose: 125g at end, Ground Coffee: 6.3g at end.",NA,NA,NA,NA,NA,NA,NA,NA,NA,NA,NA,NA
"38",15.1,"4/28/2012",4.03,97,352,"Dog A","15.1% Imperial Stout","doga",138,"Dog A","Cacao, Coffee, Chili Imperial Anniversary Stout.","05/2012","Our anniversary stout was based on AB:04, one of our most sought after beers ever. This beer is slightly different each year, with subtle variations coming into play purely down to environmental and fermentation factors. What doesn't change is the rich dark chocolate, bitter coffee and chili warmth of this monumental stout.","https://images.punkapi.com/v2/138.png",15,90,1003,1120,100,50,4.4,98,20,"liters",25,"liters","Blackened cajun beef","Cave-aged cheddar","Flourless chocolate chilli cake","Be really careful when mashing, as this amount of malt can get tough to sparge! Add honey into the boil, and naga chili and vanilla in maturation (soak them in some neutral spirit to sanitise)","Sam Mason <samjbmason>",NA,NA,0,0,0,0,0,0,0,0,0,0,0,0,0,0,0,0,0,0,0,0,0,0,0,0,0,0,0,0,0,25,0,0,0,0,0,0,0,0,0,0,0,0,0,0,0,0,50,0,0,0,0,0,0,0,0,0,0,0,12.5,12.5,0,0,0,0,0,0,0,0,0,0,0,0,0,0,0,0,0,0,0,0,0,0,0,0,0,0,0,0,0,0,0,0,0,0,0,0,0,0,0,0,0,0,0,0,0,0,0,0,0,0,25,25,0,0,0,0,0,0,0,0,0,0,0,0,0,0,0,0,0,0,0,0,0,0,0,0,0,0,0,0,0,0,0,0,0,0,0,0,0,0,0,0,0,0,0,0,0,0,0,0,0,0,0,0,0,0,0,0,0,0,0,0,0,0,0,0,0,0,0,0,0,0,0,0,0,0,0,0,0,0,0,0,0,0,0,0,0,0,0,0,0,0,0,0,0,0,0,0,0,0,0,0,0,0,0,0,0,0,0,0,0,0,0,0,0,0,0,0,0,0,0,0,0,0,0,0,"kilograms",0,0,0,0,0,0,0,0,0,0,0,0,0,0.63,0,0.63,0,0,0,0,0,0,0,0,0,0,0,0,0.88,0,0,0,0,0,0,8,0,0,0,0,0,0,0,0,1.38,0,0.7,0,0,0,0,0,0,0,0,0,0,0,0,0,0,0,0,0,0,0,0,0,0,0,0,0,0,0,0,0,0,0,0,0,0,0,0,0,0,0,0,0.5,0,0,0,65,"celsius",90,19,"celsius","Based on AB:04, but with added vanilla and 3.5 times the chili.",NA,NA,NA,NA,NA,NA,NA,NA,NA,NA,NA,NA
"39",15.1,"7/3/2013",NA,NA,NA,"Dog B","15.1% Imperial Stout","dogb",27,"Dog B","Cacao, Coffee Chili Anniversary Stout.","05/2013","Our anniversary stout was based on AB:04, one of our most sought after beers ever. This beer is slightly different each year, with subtle variations coming into play purely down to environmental and fermentation factors. What doesn't change is the rich dark chocolate, bitter coffee and chilli warmth of this monumental Stout.","https://images.punkapi.com/v2/27.png",15,90,1003,1120,100,50,4.4,98,20,"liters",25,"liters","Blackened cajun beef","Blue cheese","Flourless chocolate cheesecake","Be really careful when mashing, as this amount of malts can get tough to sparge! Add honey into the boil, and naga chili and vanilla in maturation (soak them in some neutral spirit to sanitise).","Sam Mason <samjbmason>",NA,NA,0,0,0,0,0,0,0,0,0,0,0,0,0,0,0,0,0,0,0,0,0,0,0,0,0,0,0,0,0,25,0,0,0,0,0,0,0,0,0,0,0,0,0,0,0,0,50,0,0,0,0,0,0,0,0,0,0,0,0,0,0,0,0,12.5,12.5,0,0,0,0,0,0,0,0,0,0,0,0,0,0,0,0,0,0,0,0,0,0,0,0,0,0,0,0,0,0,0,0,0,0,0,0,0,0,0,0,0,25,0,25,0,0,0,0,0,0,0,0,0,0,0,0,0,0,0,0,0,0,0,0,0,0,0,0,0,0,0,0,0,0,0,0,0,0,0,0,0,0,0,0,0,0,0,0,0,0,0,0,0,0,0,0,0,0,0,0,0,0,0,0,0,0,0,0,0,0,0,0,0,0,0,0,0,0,0,0,0,0,0,0,0,0,0,0,0,0,0,0,0,0,0,0,0,0,0,0,0,0,0,0,0,0,0,0,0,0,0,0,0,0,0,0,0,0,0,0,0,0,0,0,0,0,0,0,0,0,0,"kilograms",0,0,0,0,0,0,0,0,0,0,0,0,0,0.63,0,0.63,0,0,0,0,0,0,0,0,0,0,0,0,0.88,0,0,0,0,0,0,8,0,0,0,0,0,0,0,0,1.38,0,0.7,0,0,0,0,0,0,0,0,0,0,0,0,0,0,0,0,0,0,0,0,0,0,0,0,0,0,0,0,0,0,0,0,0,0,0,0,0,0,0,0,0.5,0,0,0,65,"celsius",90,19,"celsius","Based on AB:04, but with added vanilla and 3.5 times the chilli.",NA,NA,NA,NA,NA,NA,NA,NA,NA,NA,NA,NA
"40",15.1,"7/9/2014",NA,NA,NA,"Dog C","15.1% Imperial Stout","dogc",202,"Dog C","Cacao, Coffee Chili Anniversary Stout.","05/2014","Our anniversary stout was based on AB:04, one of our most sought after beers ever. This beer is slightly different each year, with subtle variations coming into play purely down to environmental and fermentation factors. What doesn't change is the rich dark chocolate, bitter coffee and chilli warmth of this monumental stout.","https://images.punkapi.com/v2/202.png",15,90,1003,1120,100,50,4.4,98,20,"liters",25,"liters","Blackened cajun beef","Blue cheese","Flourless chocolate cheesecake","Be really careful when mashing, as this amount of malts can get tough to sparge! Add honey into the boil, and naga chilli and vanilla in maturation (soak them in some neutral spirit to sanitise).","Sam Mason <samjbmason>",NA,NA,0,0,0,0,0,0,0,0,0,0,0,0,0,0,0,0,0,0,0,0,0,0,0,0,0,0,0,0,0,25,0,0,0,0,0,0,0,0,0,0,0,0,0,0,0,0,50,0,0,0,0,0,0,0,0,0,0,0,0,0,0,12.5,12.5,0,0,0,0,0,0,0,0,0,0,0,0,0,0,0,0,0,0,0,0,0,0,0,0,0,0,0,0,0,0,0,0,0,0,0,0,0,0,0,0,0,0,0,0,0,0,0,25,25,0,0,0,0,0,0,0,0,0,0,0,0,0,0,0,0,0,0,0,0,0,0,0,0,0,0,0,0,0,0,0,0,0,0,0,0,0,0,0,0,0,0,0,0,0,0,0,0,0,0,0,0,0,0,0,0,0,0,0,0,0,0,0,0,0,0,0,0,0,0,0,0,0,0,0,0,0,0,0,0,0,0,0,0,0,0,0,0,0,0,0,0,0,0,0,0,0,0,0,0,0,0,0,0,0,0,0,0,0,0,0,0,0,0,0,0,0,0,0,0,0,0,0,0,"kilograms",0,0,0,0,0,0,0,0,0,0,0,0,0,0.63,0,0.63,0,0,0,0,0,0,0,0,0,0,0,0,0.88,0,0,0,0,0,0,7.5,0,0,0,0,0,0,0,0,1.38,0,0.5,0,0,0,0,0,0,0,0,0,0,0,0,0,0,0,0,0,0,0,0,0,0,0,0,0,0,0,0,0,0.75,0,0,0,0,0,0,0,0,0,0,0.5,0,0,0,65,"celsius",NA,19,"celsius","Based on AB:04, but with added vanilla and 3.5 times the chilli.",NA,NA,NA,NA,NA,NA,NA,NA,NA,NA,NA,NA
"41",16.1,"6/6/2015",3.93,93,158,"Dog D","16.1% Imperial Stout","dogd",177,"Dog D","Anniversary Imperial Stout.","05/2015","Dog D is an extra special brew, marking 8 years of BrewDog. Like Dog A, B & C before it, Dog D is an Imperial Stout with speciality ingredients, only this time we’ve barrel-aged it too. Dog D pours like dark matter into your glass, with a deep tan head. The nose is subtle but powerful, and on the palate, there’s a treacle toffee backbone, supporting the spicy hop flavour and naga chilli heat.","https://images.punkapi.com/v2/177.png",16.1,85,1015,1125,400,200,4.3,84,20,"liters",25,"liters","Sriracha infused shredded beef","Chipotle steak tacos","Chilli chocolate fondant","Steep the coffee in the hot wort for short periods to get the best extraction of aromatic oils, without gaining too much bitterness.","Joakim Skoog <joakimskoog>",NA,NA,0,0,0,0,0,0,0,0,0,0,0,0,0,0,0,0,0,0,0,0,0,0,0,0,0,0,0,0,0,0,0,0,0,0,0,0,0,0,0,0,0,0,0,0,0,0,50,0,0,0,0,0,0,0,0,0,0,0,0,0,0,0,0,0,0,25,0,0,0,0,0,0,0,0,0,0,0,0,0,0,0,0,0,0,0,0,0,0,0,0,0,0,0,0,0,0,0,0,0,0,0,0,0,0,0,0,0,0,0,0,25,25,0,0,0,0,0,0,0,1.5,0,0,0,0,0,0,0,0,0,0,0,0,0,0,0,0,0,0,0,0,0,0,0,0,0,0,0,1250,0,0,0,0,0,0,0,0,0,0,0,0,0,0,0,0,0,0,0,0,0,0,0,0,0,0,0,0,0,0,0,0,0,0,0,0,0,0,0,0,0,0,0,0,0,0,0,0,0,0,0,0,0,0,0,0,0,0,0,0,0,0,0,0,0,0,0,0,0,0,0,0,0,0,0,0,0,0,0,0,0,0,0,0,0,0,25,0,"kilograms",0,0,0,0,0,0,0.75,0,0,0,0,0,0,0.5,0,0.5,0,0,0,0,0,0,0,0,0,0,0,0,0.75,0,0,0,0,0,0,0,0,0,0,0,0,0,0,0,0.75,0,0,0,0,0,0,0,0,0,0,0,0,0,7.5,0,0,0,0,0,0,0,0,0,0,0,0,0,0,0,0,0,0.75,0,0,0,0,0,0,0,0,0,0,0.5,0,0,0,63,"celsius",90,21,"celsius","Add 1 naga chilli in the FV",NA,NA,NA,NA,NA,NA,NA,NA,NA,NA,NA,NA
